id;name;price;city;promo_price;link
3405625;Конструктор LEGO Ninjago Скорострельный истребитель Коула 71736;4309;Saint Petersburg;NULL;https://www.detmir.ru/product/index/id/3405625/
619001;Конструктор LEGO Classic Набор для творчества большого размера (10698);4549;Saint Petersburg;NULL;https://www.detmir.ru/product/index/id/619001/
3405621;Конструктор LEGO Ninjago Дракон из джунглей 71746;4309;Saint Petersburg;NULL;https://www.detmir.ru/product/index/id/3405621/
3200892;Конструктор LEGO Star Wars Episode IX Сокол Тысячелетия 75257;16189;Saint Petersburg;NULL;https://www.detmir.ru/product/index/id/3200892/
3200885;Конструктор LEGO Star Wars Пушка Звезды смерти 75246;2029;Saint Petersburg;NULL;https://www.detmir.ru/product/index/id/3200885/
3405641;Конструктор LEGO Star Wars Испытание на Татуине 75299;3349;Saint Petersburg;NULL;https://www.detmir.ru/product/index/id/3405641/
3166176;Конструктор LEGO Minifigures Серия Disney 2 71024;289;Saint Petersburg;NULL;https://www.detmir.ru/product/index/id/3166176/
3244538;Конструктор LEGO Side Подводная лодка Джей-Би 70433;2029;Saint Petersburg;NULL;https://www.detmir.ru/product/index/id/3244538/
3239916;Набор для творчества LEGO DOTS Браслет Попугайчики 41912;529;Saint Petersburg;299;https://www.detmir.ru/product/index/id/3239916/
3596976;Конструктор LEGO Ninjago Спидер-амфибия ниндзя 71752;4309;Saint Petersburg;NULL;https://www.detmir.ru/product/index/id/3596976/
3405536;Конструктор LEGO Classic Кубики и колёса 11014;5389;Saint Petersburg;NULL;https://www.detmir.ru/product/index/id/3405536/
3597018;Конструктор LEGO Ninjago Водный дракон 71754;7789;Saint Petersburg;NULL;https://www.detmir.ru/product/index/id/3597018/
3142049;Конструктор LEGO Technic ДУ Скоростной вездеход 42095;8389;Saint Petersburg;6999;https://www.detmir.ru/product/index/id/3142049/
3156354;Конструктор LEGO Marvel Super Heroes Лаборатория Железного человека 76125;6589;Saint Petersburg;NULL;https://www.detmir.ru/product/index/id/3156354/
3596840;Конструктор LEGO DOTS Творческий набор для дизайнера 41938;4309;Saint Petersburg;3699;https://www.detmir.ru/product/index/id/3596840/
3405592;Конструктор LEGO City Great Vehicles Трактор 60287;1789;Saint Petersburg;1499;https://www.detmir.ru/product/index/id/3405592/
2497101;Конструктор LEGO City Police Мобильный командный центр (60139);3949;Saint Petersburg;NULL;https://www.detmir.ru/product/index/id/2497101/
3597035;Конструктор LEGO Harry Potter Хогвартс: Тайная комната 76389;13499;Saint Petersburg;NULL;https://www.detmir.ru/product/index/id/3597035/
3244598;Конструктор LEGO Harry Potter Тисовая улица дом 4 75968;7789;Saint Petersburg;NULL;https://www.detmir.ru/product/index/id/3244598/
3244510;Конструктор LEGO Friends Штаб спасателей 41424;8989;Saint Petersburg;NULL;https://www.detmir.ru/product/index/id/3244510/
3405646;Конструктор LEGO Technic Гоночный самолёт 42117;1069;Saint Petersburg;NULL;https://www.detmir.ru/product/index/id/3405646/
3226653;Конструктор LEGO City Police Полицейский участок 60246;10789;Saint Petersburg;NULL;https://www.detmir.ru/product/index/id/3226653/
3226589;Конструктор LEGO Creator Спортивный автомобиль 31100;1069;Saint Petersburg;NULL;https://www.detmir.ru/product/index/id/3226589/
3176052;Конструктор LEGO Harry Potter Часовая башня Хогвартса 75948;10189;Saint Petersburg;NULL;https://www.detmir.ru/product/index/id/3176052/
3142077;Конструктор LEGO City Fire Пожар в бургер-кафе 60214;2989;Saint Petersburg;2689;https://www.detmir.ru/product/index/id/3142077/
2496001;Конструктор LEGO Creator Грозный динозавр (31058);1669;Saint Petersburg;NULL;https://www.detmir.ru/product/index/id/2496001/
2997142;Конструктор LEGO Constraction Star Wars Рей (75528);2389;Saint Petersburg;1999;https://www.detmir.ru/product/index/id/2997142/
3475280;Конструктор LEGO Ninjago Дракон Оверлорда 71742;3109;Saint Petersburg;NULL;https://www.detmir.ru/product/index/id/3475280/
3226697;Конструктор LEGO Hidden Side Пляжный багги Джека 70428;2029;Saint Petersburg;NULL;https://www.detmir.ru/product/index/id/3226697/
3596765;Конструктор LEGO Minecraft Разрушенный портал 21172;3229;Saint Petersburg;NULL;https://www.detmir.ru/product/index/id/3596765/
3596769;Конструктор LEGO Creator Приключения на космическом шаттле 31117;5389;Saint Petersburg;NULL;https://www.detmir.ru/product/index/id/3596769/
3597028;Конструктор LEGO Super Heroes Перчатка бесконечности 76191;8389;Saint Petersburg;6699;https://www.detmir.ru/product/index/id/3597028/
3226681;Конструктор LEGO City Great Vehicles Транспортировщик скоростных катеров 60254;2989;Saint Petersburg;2499;https://www.detmir.ru/product/index/id/3226681/
3405546;Конструктор LEGO Disney Princess Книга сказочных приключений Эльзы и Нока 43189;2029;Saint Petersburg;1349;https://www.detmir.ru/product/index/id/3405546/
3122105;Конструктор LEGO Harry Potter Большой зал Хогвартса 75954;10789;Saint Petersburg;NULL;https://www.detmir.ru/product/index/id/3122105/
3597048;Конструктор LEGO Speed Champions McLaren Elva 76902;2149;Saint Petersburg;NULL;https://www.detmir.ru/product/index/id/3597048/
3175977;Конструктор LEGO City Space Port Ракета для запуска в далекий космос и пульт управления запуском 60228;10789;Saint Petersburg;NULL;https://www.detmir.ru/product/index/id/3175977/
3144096;Конструктор LEGO Creator Обитатели морских глубин 31088;1669;Saint Petersburg;NULL;https://www.detmir.ru/product/index/id/3144096/
3018950;Конструктор LEGO Тренировки на островах Эч-То Star Wars TM (75200);2629;Saint Petersburg;NULL;https://www.detmir.ru/product/index/id/3018950/
3405586;Конструктор LEGO City Police Транспорт для перевозки преступников 60276;1909;Saint Petersburg;NULL;https://www.detmir.ru/product/index/id/3405586/
3596772;Конструктор LEGO Friends Тренировка лошади и прицеп для перевозки 41441;2989;Saint Petersburg;2499;https://www.detmir.ru/product/index/id/3596772/
3405611;Конструктор LEGO Jurassic World Велоцираптор: спасение на биплане 75942;3349;Saint Petersburg;NULL;https://www.detmir.ru/product/index/id/3405611/
3597027;Конструктор LEGO Super Heroes Железный человек: схватка с Железным Торговцем 76190;4429;Saint Petersburg;NULL;https://www.detmir.ru/product/index/id/3597027/
3596975;Конструктор LEGO Ninjago Водный робот Ллойда 71750;2029;Saint Petersburg;NULL;https://www.detmir.ru/product/index/id/3596975/
3777766;Конструктор LEGO Super Heroes Новогодний календарь 76196;3349;Saint Petersburg;NULL;https://www.detmir.ru/product/index/id/3777766/
3244548;Конструктор LEGO Minifigures 20 71027;289;Saint Petersburg;NULL;https://www.detmir.ru/product/index/id/3244548/
3405637;Конструктор LEGO Minecraft 21168;3229;Saint Petersburg;NULL;https://www.detmir.ru/product/index/id/3405637/
3405653;Конструктор LEGO Technic Monster Jam Max-D 42119;2029;Saint Petersburg;NULL;https://www.detmir.ru/product/index/id/3405653/
3405620;Конструктор LEGO Ninjago Мотоцикл Ллойда для джунглей 71745;2029;Saint Petersburg;NULL;https://www.detmir.ru/product/index/id/3405620/
3405560;Конструктор LEGO Friends Кьюб Андреа с кроликом 41666;889;Saint Petersburg;619;https://www.detmir.ru/product/index/id/3405560/
3244599;Конструктор LEGO Harry Potter Астрономическая башня Хогвартса 75969;11389;Saint Petersburg;NULL;https://www.detmir.ru/product/index/id/3244599/
3244513;Конструктор LEGO Friends Летний аквапарк 41430;11389;Saint Petersburg;NULL;https://www.detmir.ru/product/index/id/3244513/
3498472;Конструктор LEGO Disney Princess Райя и дракон Сису 43184;3109;Saint Petersburg;NULL;https://www.detmir.ru/product/index/id/3498472/
3226650;Конструктор LEGO City Police Погоня на полицейском вертолете 60243;2989;Saint Petersburg;NULL;https://www.detmir.ru/product/index/id/3226650/
3405601;Конструктор LEGO DC Super Heroes Монстр-трак Человека-Паука против Мистерио 76174;5629;Saint Petersburg;NULL;https://www.detmir.ru/product/index/id/3405601/
3244592;Конструктор LEGO Ninjago Подземелье колдуна-скелета 71722;10789;Saint Petersburg;NULL;https://www.detmir.ru/product/index/id/3244592/
3175869;Конструктор LEGO Friends Катер для спасательных операций 41381;8389;Saint Petersburg;NULL;https://www.detmir.ru/product/index/id/3175869/
3405634;Конструктор LEGO Harry Potter Учёба в Хогвартсе Урок травологии 76384;3349;Saint Petersburg;NULL;https://www.detmir.ru/product/index/id/3405634/
3181586;Конструктор LEGO Star Wars Спасение Люка на планете Хот 75203;3589;Saint Petersburg;NULL;https://www.detmir.ru/product/index/id/3181586/
3405638;Конструктор LEGO Minecraft 21169;6589;Saint Petersburg;NULL;https://www.detmir.ru/product/index/id/3405638/
3122104;Конструктор LEGO Harry Potter Гремучая ива 75953;7789;Saint Petersburg;NULL;https://www.detmir.ru/product/index/id/3122104/
3142211;Конструктор LEGO Movie Падруженский Звездолёт Мими Катавасии 70830;6349;Saint Petersburg;NULL;https://www.detmir.ru/product/index/id/3142211/
3142079;Конструктор LEGO City Fire Центральная пожарная станция 60216;10789;Saint Petersburg;NULL;https://www.detmir.ru/product/index/id/3142079/
619011;Конструктор LEGO Classic Набор для творчества среднего размера (10696);2989;Saint Petersburg;NULL;https://www.detmir.ru/product/index/id/619011/
3386282;Конструктор LEGO Minecraft Торговый пост 21167;2149;Saint Petersburg;NULL;https://www.detmir.ru/product/index/id/3386282/
3386281;Конструктор LEGO Minecraft Заброшенная шахта 21166;2149;Saint Petersburg;NULL;https://www.detmir.ru/product/index/id/3386281/
3156357;Конструктор LEGO Star Wars Битва при базе Старкиллер 75236;1789;Saint Petersburg;NULL;https://www.detmir.ru/product/index/id/3156357/
3597031;Конструктор LEGO Super Heroes Железный Человек Тони Старка на Сакааре 76194;3589;Saint Petersburg;NULL;https://www.detmir.ru/product/index/id/3597031/
3194226;Конструктор LEGO Minifigures Серия 19 в непрозрачной упаковке (Сюрприз) 71025;289;Saint Petersburg;NULL;https://www.detmir.ru/product/index/id/3194226/
3200891;Конструктор LEGO Star Wars Episode IX Шаттл Кайло Рена 75256;13789;Saint Petersburg;NULL;https://www.detmir.ru/product/index/id/3200891/
3396151;Конструктор LEGO Star Wars Малыш 75318;8989;Saint Petersburg;NULL;https://www.detmir.ru/product/index/id/3396151/
3597054;Конструктор LEGO Jurassic World Побег барионикса на катере 76942;8989;Saint Petersburg;NULL;https://www.detmir.ru/product/index/id/3597054/
3176049;Конструктор LEGO Ninjago Замок проклятого императора 70678;8989;Saint Petersburg;NULL;https://www.detmir.ru/product/index/id/3176049/
3244600;Конструктор LEGO Minecraft Набор для творчества 3.0 21161;8989;Saint Petersburg;NULL;https://www.detmir.ru/product/index/id/3244600/
3244549;Конструктор LEGO Super Heroes Халкбастер против агента А.И.М. 76164;4429;Saint Petersburg;NULL;https://www.detmir.ru/product/index/id/3244549/
3596768;Конструктор LEGO Minecraft Мерзость из джунглей 21176;4429;Saint Petersburg;NULL;https://www.detmir.ru/product/index/id/3596768/
3244534;Конструктор LEGO City Исследовательское судно 60266;12499;Saint Petersburg;NULL;https://www.detmir.ru/product/index/id/3244534/
3758561;Конструктор LEGO Super Heroes Капитан Картер и штурмовик Гидры 76201;3349;Saint Petersburg;NULL;https://www.detmir.ru/product/index/id/3758561/
3226680;Конструктор LEGO City Great Vehicles Грузовик мороженщика 60253;1789;Saint Petersburg;NULL;https://www.detmir.ru/product/index/id/3226680/
3405541;Конструктор LEGO Creator Домик на дереве для сафари 31116;3229;Saint Petersburg;NULL;https://www.detmir.ru/product/index/id/3405541/
3405649;Конструктор LEGO Technic Квадроцикл 42124;14989;Saint Petersburg;11999;https://www.detmir.ru/product/index/id/3405649/
3226647;Конструктор LEGO Disney Princess Праздник в замке Золушки 43178;2989;Saint Petersburg;NULL;https://www.detmir.ru/product/index/id/3226647/
3244590;Конструктор LEGO Ninjago Каменный робот огня 71720;7789;Saint Petersburg;NULL;https://www.detmir.ru/product/index/id/3244590/
3018971;Конструктор LEGO Грузовик MACK Technic (42078);11999;Saint Petersburg;NULL;https://www.detmir.ru/product/index/id/3018971/
3405632;Конструктор LEGO Harry Potter Учёба в Хогвартсе Урок трансфигурации 76382;3349;Saint Petersburg;NULL;https://www.detmir.ru/product/index/id/3405632/
3087054;Конструктор LEGO Jurassic World Побег стигимолоха из лаборатории 75927;3829;Saint Petersburg;NULL;https://www.detmir.ru/product/index/id/3087054/
3018898;Конструктор LEGO Чемоданчик для творчества и конструирования Classic (10713);1909;Saint Petersburg;NULL;https://www.detmir.ru/product/index/id/3018898/
3758559;Конструктор LEGO Star Wars TM Штурмовой шаттл Бракованной Партии 75314;11389;Saint Petersburg;NULL;https://www.detmir.ru/product/index/id/3758559/
3405590;Конструктор LEGO City Great Vehicles Спортивный автомобиль 60285;889;Saint Petersburg;NULL;https://www.detmir.ru/product/index/id/3405590/
3890017;Конструктор LEGO Super Heroes Бэтмобиль Тумблер схватка с Пугалом 76239;4429;Saint Petersburg;NULL;https://www.detmir.ru/product/index/id/3890017/
3176051;Конструктор LEGO Jurassic World Бой тираннозавра и робота-динозавра 75938;7499;Saint Petersburg;NULL;https://www.detmir.ru/product/index/id/3176051/
619041;Конструктор LEGO Classic Набор для творчества (10692);1549;Saint Petersburg;NULL;https://www.detmir.ru/product/index/id/619041/
3620628;Конструктор LEGO City Police Операция береговой полиции и пожарных 60308;4309;Saint Petersburg;NULL;https://www.detmir.ru/product/index/id/3620628/
3244611;Конструктор LEGO Technic Ducati Panigale V4 R 42107;5499;Saint Petersburg;NULL;https://www.detmir.ru/product/index/id/3244611/
3244579;Конструктор LEGO Super Mario Битва в замке Боузера 71369;10789;Saint Petersburg;NULL;https://www.detmir.ru/product/index/id/3244579/
3244603;Конструктор LEGO Star Wars Клоны-пехотинцы 501легиона 75280;3349;Saint Petersburg;NULL;https://www.detmir.ru/product/index/id/3244603/
3405538;Конструктор LEGO Creator Транспортировщик гоночных автомобилей 31113;2629;Saint Petersburg;NULL;https://www.detmir.ru/product/index/id/3405538/
3226711;Конструктор LEGO Ninjago Кибердракон Джея 71711;5389;Saint Petersburg;NULL;https://www.detmir.ru/product/index/id/3226711/
3596766;Конструктор LEGO Minecraft Небесная башня 21173;6589;Saint Petersburg;NULL;https://www.detmir.ru/product/index/id/3596766/
3239914;Набор для творчества LEGO DOTS Подставка для карандашей Ананас 41906;2029;Saint Petersburg;NULL;https://www.detmir.ru/product/index/id/3239914/
3226704;Конструктор LEGO Ninjago Тропический внедорожник 71700;949;Saint Petersburg;NULL;https://www.detmir.ru/product/index/id/3226704/
3244537;Конструктор LEGO City Пассажирский самолёт 60262;10789;Saint Petersburg;NULL;https://www.detmir.ru/product/index/id/3244537/
3144098;Конструктор LEGO Creator Робот для подводных исследований 31090;2149;Saint Petersburg;NULL;https://www.detmir.ru/product/index/id/3144098/
3334781;Конструктор LEGO Minifigures Harry Potter 2 71028;289;Saint Petersburg;NULL;https://www.detmir.ru/product/index/id/3334781/
3405602;Конструктор LEGO Super Heroes 76175;8989;Saint Petersburg;NULL;https://www.detmir.ru/product/index/id/3405602/
3226744;Конструктор LEGO Super Heroes Угрозы Мистерио 76149;3589;Saint Petersburg;NULL;https://www.detmir.ru/product/index/id/3226744/
3244532;Конструктор LEGO City Исследовательская подводная лодка 60264;2989;Saint Petersburg;NULL;https://www.detmir.ru/product/index/id/3244532/
3142194;Конструктор LEGO City Great Vehicles Яхта для дайвинга 60221;1789;Saint Petersburg;NULL;https://www.detmir.ru/product/index/id/3142194/
3596764;Конструктор LEGO Minecraft Конюшня 21171;2149;Saint Petersburg;NULL;https://www.detmir.ru/product/index/id/3596764/
3889884;Конструктор LEGO Super Heroes Новый Асгард Бро Тора 76200;3229;Saint Petersburg;NULL;https://www.detmir.ru/product/index/id/3889884/
3596780;Конструктор LEGO Friends Домик в лесу 41679;3109;Saint Petersburg;2599;https://www.detmir.ru/product/index/id/3596780/
3244572;Конструктор LEGO Super Mario Охраняемая крепость 71362;5629;Saint Petersburg;NULL;https://www.detmir.ru/product/index/id/3244572/
3594633;Конструктор LEGO Star Wars Шлем пехотинца-разведчика 75305;5989;Saint Petersburg;NULL;https://www.detmir.ru/product/index/id/3594633/
3597033;Конструктор LEGO Harry Potter Хогвартс: пушистая встреча 76387;4429;Saint Petersburg;NULL;https://www.detmir.ru/product/index/id/3597033/
3234224;Конструктор LEGO Trolls Домик-бутон Розочки 41251;2149;Saint Petersburg;1459;https://www.detmir.ru/product/index/id/3234224/
3156372;Конструктор LEGO Star Wars Гоночный под Энакина выпуск к 20-летнему юбилею 75258;2749;Saint Petersburg;NULL;https://www.detmir.ru/product/index/id/3156372/
3597020;Конструктор LEGO Ninjago Подводный Дар Судьбы 71756;16189;Saint Petersburg;NULL;https://www.detmir.ru/product/index/id/3597020/
3181585;Конструктор LEGO Marvel Super Heroes Капитан Марвел и атака скруллов 76127;2989;Saint Petersburg;NULL;https://www.detmir.ru/product/index/id/3181585/
3156362;Конструктор LEGO Star Wars Защита базы Эхо 75241;5389;Saint Petersburg;NULL;https://www.detmir.ru/product/index/id/3156362/
3597032;Конструктор LEGO Harry Potter Хогвартс: ошибка с оборотным зельем 76386;2149;Saint Petersburg;NULL;https://www.detmir.ru/product/index/id/3597032/
3226648;Конструктор LEGO City Police Полицейский отряд с собакой 60241;889;Saint Petersburg;NULL;https://www.detmir.ru/product/index/id/3226648/
3594629;Конструктор LEGO Super Heroes Бэтмен против Джокера погоня на Бэтмобиле 76180;3349;Saint Petersburg;NULL;https://www.detmir.ru/product/index/id/3594629/
3018946;Конструктор LEGO Истребитель типа A против бесшумного истребителя СИД (75196);1789;Saint Petersburg;NULL;https://www.detmir.ru/product/index/id/3018946/
3244536;Конструктор LEGO City Городской аэропорт 60261;5389;Saint Petersburg;NULL;https://www.detmir.ru/product/index/id/3244536/
3405540;Конструктор LEGO Creator Космический робот для горных работ 31115;2629;Saint Petersburg;NULL;https://www.detmir.ru/product/index/id/3405540/
3405539;Конструктор LEGO Creator Супербайк 31114;2149;Saint Petersburg;1799;https://www.detmir.ru/product/index/id/3405539/
3018970;Конструктор LEGO Гоночный автомобиль Technic (42077);7999;Saint Petersburg;NULL;https://www.detmir.ru/product/index/id/3018970/
3226709;Конструктор LEGO Ninjago Скоростные машины Джея и Ллойда 71709;3109;Saint Petersburg;NULL;https://www.detmir.ru/product/index/id/3226709/
3386280;Конструктор LEGO Minecraft Пасека 21165;2149;Saint Petersburg;NULL;https://www.detmir.ru/product/index/id/3386280/
3226678;Конструктор LEGO City Great Vehicles Монстр-трак 60251;889;Saint Petersburg;799;https://www.detmir.ru/product/index/id/3226678/
3226590;Конструктор LEGO Creator Монстр-трак 31101;1669;Saint Petersburg;NULL;https://www.detmir.ru/product/index/id/3226590/
3226677;Конструктор LEGO City Great Vehicles Машина для очистки улиц 60249;889;Saint Petersburg;799;https://www.detmir.ru/product/index/id/3226677/
3226626;Конструктор LEGO Technic Mini Claas Xerion 42102;1069;Saint Petersburg;NULL;https://www.detmir.ru/product/index/id/3226626/
3193106;Конструктор LEGO Hidden Side Призрачный экспресс 70424;7189;Saint Petersburg;NULL;https://www.detmir.ru/product/index/id/3193106/
3405618;Конструктор LEGO Super Mario фигурки персонажей 71386;349;Saint Petersburg;NULL;https://www.detmir.ru/product/index/id/3405618/
3142078;Конструктор LEGO City Fire Пожарное депо 60215;6589;Saint Petersburg;NULL;https://www.detmir.ru/product/index/id/3142078/
3226749;Конструктор LEGO Speed Champions Formula E Panasonic Jaguar Racing GEN2 car Jaguar I-Pace eTrophy 76898;4429;Saint Petersburg;NULL;https://www.detmir.ru/product/index/id/3226749/
3226604;Конструктор LEGO Friends Городская больница Хартлейк Сити 41394;6589;Saint Petersburg;NULL;https://www.detmir.ru/product/index/id/3226604/
3187780;Конструктор LEGO Minecraft Мост ифрита 21154;4429;Saint Petersburg;NULL;https://www.detmir.ru/product/index/id/3187780/
3405627;Конструктор LEGO Ninjago Битва с роботом Зейна 71738;6469;Saint Petersburg;NULL;https://www.detmir.ru/product/index/id/3405627/
3244619;Конструктор LEGO Dots Настольный набор 41907;2109;Saint Petersburg;NULL;https://www.detmir.ru/product/index/id/3244619/
3226727;Конструктор LEGO Super Heroes Железный человек 76140;1189;Saint Petersburg;NULL;https://www.detmir.ru/product/index/id/3226727/
2497211;Конструктор LEGO DUPLO My First Поезд «Считай и играй» (10847);1789;Saint Petersburg;1499;https://www.detmir.ru/product/index/id/2497211/
3226718;Конструктор LEGO Star Wars Микрофайтеры Скайхоппер T-16 против Банты 75265;2029;Saint Petersburg;NULL;https://www.detmir.ru/product/index/id/3226718/
3405589;Конструктор LEGO City Great Vehicles Автомобиль для дорожных работ 60284;889;Saint Petersburg;549;https://www.detmir.ru/product/index/id/3405589/
3175845;Конструктор LEGO DUPLO Town Тропический остров 10906;5989;Saint Petersburg;NULL;https://www.detmir.ru/product/index/id/3175845/
3142022;Конструктор LEGO DUPLO Town Пожарная машина 10901;1789;Saint Petersburg;NULL;https://www.detmir.ru/product/index/id/3142022/
3226585;Конструктор LEGO Minecraft Аванпост разбойников 21159;3229;Saint Petersburg;NULL;https://www.detmir.ru/product/index/id/3226585/
2953981;Конструктор LEGO Friends Горнолыжный курорт: подъёмник (41324);3999;Saint Petersburg;NULL;https://www.detmir.ru/product/index/id/2953981/
