id;name;price;city;promo_price;link
3405525;Конструктор LEGO DUPLO Classic Шкатулка-сердечко 10909;1909;Saint Petersburg;NULL;https://www.detmir.ru/product/index/id/3405525/
3596717;Конструктор LEGO DUPLO Disney Дом и кафе Минни 10942;5389;Saint Petersburg;4299;https://www.detmir.ru/product/index/id/3596717/
3405583;Конструктор LEGO City Fire Спасательный пожарный вертолёт 60281;2989;Saint Petersburg;2499;https://www.detmir.ru/product/index/id/3405583/
3620627;Конструктор LEGO City Wildlife Лагерь спасения дикой природы 60307;10789;Saint Petersburg;7999;https://www.detmir.ru/product/index/id/3620627/
3596885;Конструктор LEGO City Арена для шоу каскадёров 60295;10789;Saint Petersburg;7999;https://www.detmir.ru/product/index/id/3596885/
3405530;Конструктор LEGO DUPLO Town Фермерский трактор и животные 10950;1909;Saint Petersburg;1599;https://www.detmir.ru/product/index/id/3405530/
3405531;Конструктор LEGO DUPLO Town Конюшня для лошади и пони 10951;2989;Saint Petersburg;2399;https://www.detmir.ru/product/index/id/3405531/
3596716;Конструктор LEGO DUPLO Super Heroes Штаб-квартира Человека-паука 10940;3109;Saint Petersburg;2499;https://www.detmir.ru/product/index/id/3596716/
3596884;Конструктор LEGO Грузовик для шоу каскадёров 60294;6589;Saint Petersburg;5229;https://www.detmir.ru/product/index/id/3596884/
3475282;Конструктор LEGO DUPLO Classic Веселый день рождения 10958;6589;Saint Petersburg;4999;https://www.detmir.ru/product/index/id/3475282/
3596974;Конструктор LEGO Ninjago Дар Судьбы Решающая битва 71749;4309;Saint Petersburg;2999;https://www.detmir.ru/product/index/id/3596974/
3597019;Конструктор LEGO Ninjago Храм Бескрайнего моря 71755;11989;Saint Petersburg;9999;https://www.detmir.ru/product/index/id/3597019/
3244480;Конструктор LEGO DUPLO Башенный кран на стройке 10933;11989;Saint Petersburg;9499;https://www.detmir.ru/product/index/id/3244480/
3233714;Конструктор LEGO DUPLO Большая строительная пластина 2304;1549;Saint Petersburg;1299;https://www.detmir.ru/product/index/id/3233714/
3244473;Конструктор LEGO DUPLO Бульдозер 10930;889;Saint Petersburg;649;https://www.detmir.ru/product/index/id/3244473/
3596714;Конструктор LEGO Mickey and Friends Космическая ракета Микки и Минни 10774;1909;Saint Petersburg;1599;https://www.detmir.ru/product/index/id/3596714/
3405526;Конструктор LEGO DUPLO My First Единорог 10953;949;Saint Petersburg;659;https://www.detmir.ru/product/index/id/3405526/
3758560;Конструктор LEGO Star Wars Легкий имперский крейсер 75315;16189;Saint Petersburg;NULL;https://www.detmir.ru/product/index/id/3758560/
3596785;Конструктор LEGO Friends Американские горки на Волшебной ярмарке 41685;10189;Saint Petersburg;8799;https://www.detmir.ru/product/index/id/3596785/
3596759;Конструктор LEGO DUPLO Town Парк развлечений 10956;11989;Saint Petersburg;8299;https://www.detmir.ru/product/index/id/3596759/
618981;Конструктор LEGO Classic Строительная пластина зеленого цвета (10700);829;Saint Petersburg;599;https://www.detmir.ru/product/index/id/618981/
3405548;Конструктор LEGO Friends Органическое кафе Хартлейк-Сити 41444;3109;Saint Petersburg;2129;https://www.detmir.ru/product/index/id/3405548/
3596921;Конструктор LEGO City Wildlife 60302;10189;Saint Petersburg;7999;https://www.detmir.ru/product/index/id/3596921/
3405551;Конструктор LEGO Friends Торговый центр Хартлейк Сити 41450;11389;Saint Petersburg;NULL;https://www.detmir.ru/product/index/id/3405551/
3405584;Конструктор LEGO City Fire Команда пожарных 60282;5989;Saint Petersburg;NULL;https://www.detmir.ru/product/index/id/3405584/
3475287;Конструктор LEGO Friends Парк Хартлейк Сити 41447;4309;Saint Petersburg;3199;https://www.detmir.ru/product/index/id/3475287/
3405528;Конструктор LEGO DUPLO My First Пожарный вертолет и полицейский автомобиль 10957;949;Saint Petersburg;849;https://www.detmir.ru/product/index/id/3405528/
4058545;Конструктор LEGO Disney Princess 43200;2029;Saint Petersburg;NULL;https://www.detmir.ru/product/index/id/4058545/
3193108;Конструктор LEGO Disney Frozen Волшебный ледяной замок Эльзы 43172;7789;Saint Petersburg;NULL;https://www.detmir.ru/product/index/id/3193108/
3596920;Конструктор LEGO City Wildlife Спасательный внедорожник для зверей 60301;4549;Saint Petersburg;3999;https://www.detmir.ru/product/index/id/3596920/
3405535;Конструктор LEGO Classic Прозрачные кубики 11013;3109;Saint Petersburg;NULL;https://www.detmir.ru/product/index/id/3405535/
3405614;Конструктор LEGO Super Mario дополнительный набор загадочное испытание растения-пираньи 71382;3229;Saint Petersburg;2099;https://www.detmir.ru/product/index/id/3405614/
3405550;Конструктор LEGO Friends Дом семьи Андреа 41449;7789;Saint Petersburg;6999;https://www.detmir.ru/product/index/id/3405550/
3596876;Конструктор LEGO Technic Полноприводный грузовик-внедорожник Mercedes-Benz Zetros 42129;31189;Saint Petersburg;NULL;https://www.detmir.ru/product/index/id/3596876/
3405544;Конструктор LEGO Disney Princess Королевская карета Золушки 43192;4309;Saint Petersburg;3869;https://www.detmir.ru/product/index/id/3405544/
3985290;Конструктор LEGO Super Heroes Бэтмобиль Тумблер 76240;26389;Saint Petersburg;NULL;https://www.detmir.ru/product/index/id/3985290/
3596756;Конструктор LEGO DUPLO Town Гоночные машины 10947;5389;Saint Petersburg;3769;https://www.detmir.ru/product/index/id/3596756/
3244614;Конструктор LEGO Technic Lamborghini Sian FKP 37 42115;44149;Saint Petersburg;NULL;https://www.detmir.ru/product/index/id/3244614/
3596888;Конструктор LEGO City Stunt 60298;709;Saint Petersburg;629;https://www.detmir.ru/product/index/id/3596888/
3620623;Конструктор LEGO Mickey and Friends Ферма Микки и Дональда 10775;3109;Saint Petersburg;2399;https://www.detmir.ru/product/index/id/3620623/
3200882;Конструктор LEGO Disney Frozen Шкатулка Эльзы 41168;4309;Saint Petersburg;3869;https://www.detmir.ru/product/index/id/3200882/
3498474;Конструктор LEGO Vidiyo Бэндмейты 43101;469;Saint Petersburg;229;https://www.detmir.ru/product/index/id/3498474/
3777764;Конструктор LEGO City Occasions Новогодний календарь 60303;2029;Saint Petersburg;NULL;https://www.detmir.ru/product/index/id/3777764/
3596770;Конструктор LEGO Creator Колесо обозрения 31119;10189;Saint Petersburg;NULL;https://www.detmir.ru/product/index/id/3596770/
3597052;Конструктор LEGO Jurassic World Скелет тираннозавра на выставке 76940;3349;Saint Petersburg;NULL;https://www.detmir.ru/product/index/id/3597052/
3597021;Конструктор LEGO Star Wars Дуэль на Мандалоре 75310;2149;Saint Petersburg;1499;https://www.detmir.ru/product/index/id/3597021/
3596763;Конструктор LEGO Classic Вокруг света 11015;5389;Saint Petersburg;4499;https://www.detmir.ru/product/index/id/3596763/
3599721;Конструктор LEGO VIDIYO Candy Castle Stage (Сцена карамельного замка) 43111;2989;Saint Petersburg;1489;https://www.detmir.ru/product/index/id/3599721/
3777767;Конструктор LEGO Harry Potter Новогодний календарь 76390;3109;Saint Petersburg;NULL;https://www.detmir.ru/product/index/id/3777767/
3405655;Конструктор LEGO Technic Ferrari 488 GTE 42125;20269;Saint Petersburg;NULL;https://www.detmir.ru/product/index/id/3405655/
3234225;Конструктор LEGO Trolls Путешествие Розочки на воздушном шаре 41252;3589;Saint Petersburg;2342;https://www.detmir.ru/product/index/id/3234225/
3777569;Конструктор LEGO Friends Новогодний календарь 41690;2389;Saint Petersburg;NULL;https://www.detmir.ru/product/index/id/3777569/
3405555;Конструктор LEGO Friends Ветеринарная клиника Хартлейк-Сити 41446;4309;Saint Petersburg;NULL;https://www.detmir.ru/product/index/id/3405555/
3597051;Конструктор LEGO Jurassic World Побег стигимолоха 76939;4429;Saint Petersburg;3899;https://www.detmir.ru/product/index/id/3597051/
3099183;Конструктор LEGO City Trains Рельсы 60205;1789;Saint Petersburg;NULL;https://www.detmir.ru/product/index/id/3099183/
3596882;Конструктор LEGO Disney Princess Ледяной замок 43197;23629;Saint Petersburg;NULL;https://www.detmir.ru/product/index/id/3596882/
3226570;Конструктор LEGO Classic Кубики и домики 11008;1909;Saint Petersburg;NULL;https://www.detmir.ru/product/index/id/3226570/
3597053;Конструктор LEGO Jurassic World Погоня за карнотавром 76941;5509;Saint Petersburg;NULL;https://www.detmir.ru/product/index/id/3597053/
3244612;Конструктор LEGO Technic Самосвал Volvo 6*6 42114;27589;Saint Petersburg;NULL;https://www.detmir.ru/product/index/id/3244612/
3597029;Конструктор LEGO Super Heroes «Мстители: Финал» — решающая битва 76192;10189;Saint Petersburg;NULL;https://www.detmir.ru/product/index/id/3597029/
3405542;Конструктор LEGO Creator Пляжный домик серферов 31118;5389;Saint Petersburg;NULL;https://www.detmir.ru/product/index/id/3405542/
3594628;Конструктор LEGO Super Heroes Битва в древней деревне 76177;4429;Saint Petersburg;NULL;https://www.detmir.ru/product/index/id/3594628/
3244544;Конструктор LEGO Minions Тренировочный полёт 75547;3589;Saint Petersburg;NULL;https://www.detmir.ru/product/index/id/3244544/
3405549;Конструктор LEGO Friends Кинотеатр Хартлейк-Сити 41448;5389;Saint Petersburg;4299;https://www.detmir.ru/product/index/id/3405549/
3596878;Конструктор LEGO Disney Princess Книга сказочных приключений Ариэль Белль Золушки и Тианы 43193;2389;Saint Petersburg;NULL;https://www.detmir.ru/product/index/id/3596878/
3405636;Конструктор LEGO Minecraft Коралловый риф 21164;1189;Saint Petersburg;NULL;https://www.detmir.ru/product/index/id/3405636/
3596926;Конструктор LEGO Super Mario Падающая башня босса братца-сумо 71388;3229;Saint Petersburg;2599;https://www.detmir.ru/product/index/id/3596926/
3188096;Конструктор LEGO DUPLO Princess Ледяной замок 10899;5389;Saint Petersburg;4849;https://www.detmir.ru/product/index/id/3188096/
3475286;Конструктор LEGO Friends Набор кубиков Хартлейк Сити 41431;4309;Saint Petersburg;NULL;https://www.detmir.ru/product/index/id/3475286/
3596783;Конструктор LEGO Friends Лесной клуб верховой езды 41683;7789;Saint Petersburg;6199;https://www.detmir.ru/product/index/id/3596783/
3597050;Конструктор LEGO Speed Champions Mopar Dodge//SRT Top Fuel Dragster and 1970 Dodge Challenger T/A 76904;6589;Saint Petersburg;NULL;https://www.detmir.ru/product/index/id/3597050/
3405529;Конструктор LEGO DUPLO Town Уход за животными на ферме 10949;889;Saint Petersburg;749;https://www.detmir.ru/product/index/id/3405529/
3405596;Конструктор LEGO Super Heroes Воздушное нападение Вечных 76145;1189;Saint Petersburg;NULL;https://www.detmir.ru/product/index/id/3405596/
3596715;Конструктор LEGO Mickey and Friends Пожарная часть и машина Микки и его друзей 10776;5389;Saint Petersburg;3769;https://www.detmir.ru/product/index/id/3596715/
3200890;Конструктор LEGO Star Wars Йода 75255;11389;Saint Petersburg;NULL;https://www.detmir.ru/product/index/id/3200890/
3599722;Конструктор LEGO VIDIYO Robo HipHop Car (Машина Хип-Хоп Робота) 43112;2989;Saint Petersburg;1489;https://www.detmir.ru/product/index/id/3599722/
3596887;Конструктор LEGO City Stunt 60297;709;Saint Petersburg;629;https://www.detmir.ru/product/index/id/3596887/
3244543;Конструктор LEGO Minions Миньоны в лаборатории Грю 75546;2149;Saint Petersburg;NULL;https://www.detmir.ru/product/index/id/3244543/
3405626;Конструктор LEGO Ninjago Ниндзя-перехватчик Х-1 71737;5389;Saint Petersburg;NULL;https://www.detmir.ru/product/index/id/3405626/
3405543;Конструктор LEGO Disney Princess Праздничный корабль Ариэль 43191;3109;Saint Petersburg;NULL;https://www.detmir.ru/product/index/id/3405543/
3596822;Конструктор LEGO Dots Подставка для карандашей 41936;2029;Saint Petersburg;NULL;https://www.detmir.ru/product/index/id/3596822/
3599719;Конструктор LEGO VIDIYO Metal Dragon BeatBox (Битбокс Дракона-Металлиста) 43109;1789;Saint Petersburg;889;https://www.detmir.ru/product/index/id/3599719/
3405534;Конструктор LEGO Jurassic World Побег динозавров: тираннозавр и трицератопс 10939;3109;Saint Petersburg;NULL;https://www.detmir.ru/product/index/id/3405534/
3498483;Конструктор LEGO Star Wars Микрофайтеры AT-AT против таунтауна 75298;2149;Saint Petersburg;NULL;https://www.detmir.ru/product/index/id/3498483/
3244527;Конструктор LEGO Dots Браслет Мороженое 41910;649;Saint Petersburg;389;https://www.detmir.ru/product/index/id/3244527/
618971;Строительная пластина LEGO Classic Серая (10701);1549;Saint Petersburg;1299;https://www.detmir.ru/product/index/id/618971/
3596778;Конструктор LEGO Friends Кьюб Андреа для плавания 41671;889;Saint Petersburg;619;https://www.detmir.ru/product/index/id/3596778/
3594627;Конструктор LEGO Super Heroes Побег от Десяти колец 76176;3349;Saint Petersburg;NULL;https://www.detmir.ru/product/index/id/3594627/
3226558;Конструктор LEGO DUPLO Грузовик Алфавит 10915;2989;Saint Petersburg;NULL;https://www.detmir.ru/product/index/id/3226558/
3405533;Конструктор LEGO DUPLO Disney Праздничный поезд Микки и Минни 10941;3109;Saint Petersburg;NULL;https://www.detmir.ru/product/index/id/3405533/
3150682;Конструктор LEGO Technic Porsche 911 RSR 42096;16789;Saint Petersburg;NULL;https://www.detmir.ru/product/index/id/3150682/
3244576;Конструктор LEGO Super Mario Огневой налёт Билла-банзай 71366;3229;Saint Petersburg;2099;https://www.detmir.ru/product/index/id/3244576/
3176040;Конструктор LEGO DUPLO Town Животные мира 10907;10789;Saint Petersburg;NULL;https://www.detmir.ru/product/index/id/3176040/
3405580;Конструктор LEGO City Town Дорожные пластины 60304;1789;Saint Petersburg;1599;https://www.detmir.ru/product/index/id/3405580/
3200883;Конструктор LEGO Disney Frozen Олаф 41169;1299;Saint Petersburg;649;https://www.detmir.ru/product/index/id/3200883/
3596774;Конструктор LEGO Friends Кьюб Оливии для игр 41667;889;Saint Petersburg;799;https://www.detmir.ru/product/index/id/3596774/
3405598;Конструктор LEGO Super Heroes Вечные перед лицом Аришема 76155;7789;Saint Petersburg;6899;https://www.detmir.ru/product/index/id/3405598/
3498482;Конструктор LEGO Star Wars Истребитель Сопротивления типа X 75297;2149;Saint Petersburg;NULL;https://www.detmir.ru/product/index/id/3498482/
3405616;Конструктор LEGO Super Mario набор усилений Марио-пингвин 71384;1069;Saint Petersburg;739;https://www.detmir.ru/product/index/id/3405616/
3596777;Конструктор LEGO Friends Кьюб для балета Стефани 41670;889;Saint Petersburg;619;https://www.detmir.ru/product/index/id/3596777/
3594626;Конструктор LEGO Minifigures Минифигурки Looney Tunes в непрозрачной упаковке (Сюрприз)71030;329;Saint Petersburg;NULL;https://www.detmir.ru/product/index/id/3594626/
3200881;Конструктор LEGO Disney Frozen Деревня в Эренделле 41167;8989;Saint Petersburg;6199;https://www.detmir.ru/product/index/id/3200881/
3498481;Конструктор LEGO Vidiyo Битбокс Хип-Хоп Робота 43107;1789;Saint Petersburg;889;https://www.detmir.ru/product/index/id/3498481/
3226695;Конструктор LEGO City Nitro Wheels Тюнинг-мастерская 60258;10789;Saint Petersburg;NULL;https://www.detmir.ru/product/index/id/3226695/
3405628;Конструктор LEGO Ninjago Легендарные битвы: Кай против Армии скелетов 71730;949;Saint Petersburg;NULL;https://www.detmir.ru/product/index/id/3405628/
3405631;Конструктор LEGO Ninjago Легендарные битвы: Коул против Призрачного воина 71733;949;Saint Petersburg;NULL;https://www.detmir.ru/product/index/id/3405631/
3405553;Конструктор LEGO Friends Передвижной груминг-салон для кошек 41439;949;Saint Petersburg;799;https://www.detmir.ru/product/index/id/3405553/
3596977;Конструктор LEGO Ninjago Атака огненного дракона 71753;5389;Saint Petersburg;NULL;https://www.detmir.ru/product/index/id/3596977/
3599720;Конструктор LEGO VIDIYO Folk Fairy BeatBox (Битбокс Феи Фолка) 43110;1789;Saint Petersburg;889;https://www.detmir.ru/product/index/id/3599720/
3596711;Конструктор LEGO Mickey and Friends Винтовой самолёт Микки 10772;949;Saint Petersburg;NULL;https://www.detmir.ru/product/index/id/3596711/
3244608;Конструктор LEGO Star Wars AT-AT 75288;16789;Saint Petersburg;NULL;https://www.detmir.ru/product/index/id/3244608/
3596836;Конструктор LEGO Dots Большой набор Летнее настроение 41937;3109;Saint Petersburg;NULL;https://www.detmir.ru/product/index/id/3596836/
3405612;Конструктор LEGO Super Mario Твои уровни! Твои приключения! 71380;6589;Saint Petersburg;NULL;https://www.detmir.ru/product/index/id/3405612/
2954071;Конструктор LEGO DUPLO Town Большой парк аттракционов (10840);8269;Saint Petersburg;NULL;https://www.detmir.ru/product/index/id/2954071/
3142206;Конструктор LEGO Movie Шкатулка королевы Многолики Собери что хочешь 70825;3589;Saint Petersburg;2869;https://www.detmir.ru/product/index/id/3142206/
3405619;Конструктор LEGO Ninjago Электрический робот Джея 71740;2029;Saint Petersburg;1699;https://www.detmir.ru/product/index/id/3405619/
3498476;Конструктор LEGO Vidiyo Битбокс Пирата Панка 43103;1789;Saint Petersburg;889;https://www.detmir.ru/product/index/id/3498476/
3405613;Конструктор LEGO Super Mario дополнительный набор Кусалкин на цепи-встреча в джунглях 71381;2629;Saint Petersburg;1753;https://www.detmir.ru/product/index/id/3405613/
3405552;Конструктор LEGO Friends Пекарня Хартлейк-Сити 41440;1909;Saint Petersburg;1699;https://www.detmir.ru/product/index/id/3405552/
3334780;Конструктор LEGO Disney Princess Лесной домик Спящей красавицы 43188;4309;Saint Petersburg;NULL;https://www.detmir.ru/product/index/id/3334780/
3142024;Конструктор LEGO DUPLO Town Пожарное депо 10903;5389;Saint Petersburg;NULL;https://www.detmir.ru/product/index/id/3142024/
3596776;Конструктор LEGO Friends Футбольный кьюб Мии 41669;889;Saint Petersburg;619;https://www.detmir.ru/product/index/id/3596776/
3405547;Конструктор LEGO Friends Электромобиль Оливии 41443;1549;Saint Petersburg;1389;https://www.detmir.ru/product/index/id/3405547/
3596818;Конструктор LEGO Dots Большой набор тайлов 41935;2149;Saint Petersburg;1499;https://www.detmir.ru/product/index/id/3596818/
3244551;Конструктор LEGO Super Heroes Геликарриер 76153;13789;Saint Petersburg;NULL;https://www.detmir.ru/product/index/id/3244551/
3596747;Конструктор LEGO DUPLO Town Мусоровоз и контейнеры для раздельного сбора мусора 10945;1789;Saint Petersburg;NULL;https://www.detmir.ru/product/index/id/3596747/
3405617;Конструктор LEGO Super Mario набор усилений Марио Тануки 71385;1069;Saint Petersburg;709;https://www.detmir.ru/product/index/id/3405617/
3244584;Конструктор LEGO Ninjago Бой на штормовом истребителе 71703;3109;Saint Petersburg;NULL;https://www.detmir.ru/product/index/id/3244584/
3244578;Конструктор LEGO Super Mario Погоня за сокровищами Тоада 71368;7789;Saint Petersburg;NULL;https://www.detmir.ru/product/index/id/3244578/
3599723;Конструктор LEGO VIDIYO K-Pawp Concert (Концерт в стиле К-поп) 43113;5389;Saint Petersburg;2689;https://www.detmir.ru/product/index/id/3599723/
3156351;Конструктор LEGO 4+ Парк аттракционов Базза и Вуди 10770;4789;Saint Petersburg;3879;https://www.detmir.ru/product/index/id/3156351/
3405545;Конструктор LEGO Disney Princess Саламандра Бруни 43186;1309;Saint Petersburg;NULL;https://www.detmir.ru/product/index/id/3405545/
3405557;Конструктор LEGO Friends Кьюб Эммы с далматинцем 41663;889;Saint Petersburg;609;https://www.detmir.ru/product/index/id/3405557/
3405576;Конструктор LEGO Dots Браслет Музыка 41933;589;Saint Petersburg;NULL;https://www.detmir.ru/product/index/id/3405576/
3405565;Конструктор LEGO Dots Креативный набор для праздника 41926;2389;Saint Petersburg;NULL;https://www.detmir.ru/product/index/id/3405565/
3405582;Конструктор LEGO City Fire Пожарная машина с лестницей 60280;1789;Saint Petersburg;1499;https://www.detmir.ru/product/index/id/3405582/
3405630;Конструктор LEGO Ninjago Легендарные битвы: Джей против воина-серпентина 71732;949;Saint Petersburg;849;https://www.detmir.ru/product/index/id/3405630/
3405607;Конструктор LEGO Super Heroes 76170;2149;Saint Petersburg;NULL;https://www.detmir.ru/product/index/id/3405607/
3596800;Конструктор LEGO Friends Волшебное колесо обозрения и горка 41689;6589;Saint Petersburg;5269;https://www.detmir.ru/product/index/id/3596800/
3108625;Конструктор LEGO City Trains Железнодорожные стрелки 60238;2149;Saint Petersburg;NULL;https://www.detmir.ru/product/index/id/3108625/
3405644;Конструктор LEGO Star Wars Мандалорец и малыш 75317;2149;Saint Petersburg;NULL;https://www.detmir.ru/product/index/id/3405644/
3890016;Конструктор LEGO Super Heroes Маска Бэтмена из классического сериала 76238;7189;Saint Petersburg;5999;https://www.detmir.ru/product/index/id/3890016/
3597026;Конструктор LEGO Super Heroes Битва Капитана Америка с Гидрой 76189;1069;Saint Petersburg;NULL;https://www.detmir.ru/product/index/id/3597026/
3498473;Конструктор LEGO Disney Princess Лодка Буна 43185;5509;Saint Petersburg;NULL;https://www.detmir.ru/product/index/id/3498473/
3596971;Конструктор LEGO Super Mario Марио-пчела 71393;1069;Saint Petersburg;899;https://www.detmir.ru/product/index/id/3596971/
3244582;Конструктор LEGO Super Mario Марио-кот 71372;1069;Saint Petersburg;NULL;https://www.detmir.ru/product/index/id/3244582/
3596968;Конструктор LEGO Super Mario Нокдаун резноров 71390;7789;Saint Petersburg;NULL;https://www.detmir.ru/product/index/id/3596968/
3596843;Конструктор LEGO Dots Брелок для сумки Единорог 41940;649;Saint Petersburg;NULL;https://www.detmir.ru/product/index/id/3596843/
3405566;Конструктор LEGO Dots Браслет Звёздное небо 41934;629;Saint Petersburg;NULL;https://www.detmir.ru/product/index/id/3405566/
