id;name;price;city;promo_price;link
3599720;Конструктор LEGO VIDIYO Folk Fairy BeatBox (Битбокс Феи Фолка) 43110;1789;Moscow;889;https://www.detmir.ru/product/index/id/3599720/
3596711;Конструктор LEGO Mickey and Friends Винтовой самолёт Микки 10772;949;Moscow;NULL;https://www.detmir.ru/product/index/id/3596711/
3596836;Конструктор LEGO Dots Большой набор Летнее настроение 41937;3109;Moscow;NULL;https://www.detmir.ru/product/index/id/3596836/
3176052;Конструктор LEGO Harry Potter Часовая башня Хогвартса 75948;10189;Moscow;NULL;https://www.detmir.ru/product/index/id/3176052/
3405612;Конструктор LEGO Super Mario Твои уровни! Твои приключения! 71380;6589;Moscow;NULL;https://www.detmir.ru/product/index/id/3405612/
3142206;Конструктор LEGO Movie Шкатулка королевы Многолики Собери что хочешь 70825;3589;Moscow;2869;https://www.detmir.ru/product/index/id/3142206/
3405619;Конструктор LEGO Ninjago Электрический робот Джея 71740;2029;Moscow;1699;https://www.detmir.ru/product/index/id/3405619/
2997142;Конструктор LEGO Constraction Star Wars Рей (75528);2389;Moscow;1999;https://www.detmir.ru/product/index/id/2997142/
3596796;Конструктор LEGO Friends Волшебный фургон 41688;5389;Moscow;NULL;https://www.detmir.ru/product/index/id/3596796/
3498476;Конструктор LEGO Vidiyo Битбокс Пирата Панка 43103;1789;Moscow;889;https://www.detmir.ru/product/index/id/3498476/
3596765;Конструктор LEGO Minecraft Разрушенный портал 21172;3229;Moscow;NULL;https://www.detmir.ru/product/index/id/3596765/
3405613;Конструктор LEGO Super Mario дополнительный набор Кусалкин на цепи-встреча в джунглях 71381;2629;Moscow;1753;https://www.detmir.ru/product/index/id/3405613/
3596769;Конструктор LEGO Creator Приключения на космическом шаттле 31117;5389;Moscow;NULL;https://www.detmir.ru/product/index/id/3596769/
3405552;Конструктор LEGO Friends Пекарня Хартлейк-Сити 41440;1909;Moscow;1699;https://www.detmir.ru/product/index/id/3405552/
3334780;Конструктор LEGO Disney Princess Лесной домик Спящей красавицы 43188;4309;Moscow;NULL;https://www.detmir.ru/product/index/id/3334780/
3596776;Конструктор LEGO Friends Футбольный кьюб Мии 41669;889;Moscow;619;https://www.detmir.ru/product/index/id/3596776/
3405547;Конструктор LEGO Friends Электромобиль Оливии 41443;1549;Moscow;1389;https://www.detmir.ru/product/index/id/3405547/
3596818;Конструктор LEGO Dots Большой набор тайлов 41935;2149;Moscow;1499;https://www.detmir.ru/product/index/id/3596818/
3144096;Конструктор LEGO Creator Обитатели морских глубин 31088;1669;Moscow;NULL;https://www.detmir.ru/product/index/id/3144096/
3244551;Конструктор LEGO Super Heroes Геликарриер 76153;13789;Moscow;NULL;https://www.detmir.ru/product/index/id/3244551/
3596747;Конструктор LEGO DUPLO Town Мусоровоз и контейнеры для раздельного сбора мусора 10945;1789;Moscow;NULL;https://www.detmir.ru/product/index/id/3596747/
3405617;Конструктор LEGO Super Mario набор усилений Марио Тануки 71385;1069;Moscow;709;https://www.detmir.ru/product/index/id/3405617/
3596772;Конструктор LEGO Friends Тренировка лошади и прицеп для перевозки 41441;2989;Moscow;2499;https://www.detmir.ru/product/index/id/3596772/
3244584;Конструктор LEGO Ninjago Бой на штормовом истребителе 71703;3109;Moscow;NULL;https://www.detmir.ru/product/index/id/3244584/
3244578;Конструктор LEGO Super Mario Погоня за сокровищами Тоада 71368;7789;Moscow;NULL;https://www.detmir.ru/product/index/id/3244578/
3599723;Конструктор LEGO VIDIYO K-Pawp Concert (Концерт в стиле К-поп) 43113;5389;Moscow;2689;https://www.detmir.ru/product/index/id/3599723/
3156351;Конструктор LEGO 4+ Парк аттракционов Базза и Вуди 10770;4789;Moscow;3879;https://www.detmir.ru/product/index/id/3156351/
3597027;Конструктор LEGO Super Heroes Железный человек: схватка с Железным Торговцем 76190;4429;Moscow;NULL;https://www.detmir.ru/product/index/id/3597027/
3405545;Конструктор LEGO Disney Princess Саламандра Бруни 43186;1309;Moscow;NULL;https://www.detmir.ru/product/index/id/3405545/
3405557;Конструктор LEGO Friends Кьюб Эммы с далматинцем 41663;889;Moscow;609;https://www.detmir.ru/product/index/id/3405557/
3405576;Конструктор LEGO Dots Браслет Музыка 41933;589;Moscow;NULL;https://www.detmir.ru/product/index/id/3405576/
3405565;Конструктор LEGO Dots Креативный набор для праздника 41926;2389;Moscow;NULL;https://www.detmir.ru/product/index/id/3405565/
3405582;Конструктор LEGO City Fire Пожарная машина с лестницей 60280;1789;Moscow;1499;https://www.detmir.ru/product/index/id/3405582/
3405620;Конструктор LEGO Ninjago Мотоцикл Ллойда для джунглей 71745;2029;Moscow;NULL;https://www.detmir.ru/product/index/id/3405620/
3405630;Конструктор LEGO Ninjago Легендарные битвы: Джей против воина-серпентина 71732;949;Moscow;849;https://www.detmir.ru/product/index/id/3405630/
3405607;Конструктор LEGO Super Heroes 76170;2149;Moscow;NULL;https://www.detmir.ru/product/index/id/3405607/
3596800;Конструктор LEGO Friends Волшебное колесо обозрения и горка 41689;6589;Moscow;5269;https://www.detmir.ru/product/index/id/3596800/
3405560;Конструктор LEGO Friends Кьюб Андреа с кроликом 41666;889;Moscow;619;https://www.detmir.ru/product/index/id/3405560/
3108625;Конструктор LEGO City Trains Железнодорожные стрелки 60238;2149;Moscow;NULL;https://www.detmir.ru/product/index/id/3108625/
3405644;Конструктор LEGO Star Wars Мандалорец и малыш 75317;2149;Moscow;NULL;https://www.detmir.ru/product/index/id/3405644/
3890016;Конструктор LEGO Super Heroes Маска Бэтмена из классического сериала 76238;7189;Moscow;5999;https://www.detmir.ru/product/index/id/3890016/
3597026;Конструктор LEGO Super Heroes Битва Капитана Америка с Гидрой 76189;1069;Moscow;NULL;https://www.detmir.ru/product/index/id/3597026/
3498473;Конструктор LEGO Disney Princess Лодка Буна 43185;5509;Moscow;NULL;https://www.detmir.ru/product/index/id/3498473/
3596971;Конструктор LEGO Super Mario Марио-пчела 71393;1069;Moscow;899;https://www.detmir.ru/product/index/id/3596971/
3181586;Конструктор LEGO Star Wars Спасение Люка на планете Хот 75203;3589;Moscow;NULL;https://www.detmir.ru/product/index/id/3181586/
3226565;Конструктор LEGO DUPLO Town Киоск-пиццерия 10927;889;Moscow;749;https://www.detmir.ru/product/index/id/3226565/
3142211;Конструктор LEGO Movie Падруженский Звездолёт Мими Катавасии 70830;6349;Moscow;NULL;https://www.detmir.ru/product/index/id/3142211/
3244582;Конструктор LEGO Super Mario Марио-кот 71372;1069;Moscow;NULL;https://www.detmir.ru/product/index/id/3244582/
3596968;Конструктор LEGO Super Mario Нокдаун резноров 71390;7789;Moscow;NULL;https://www.detmir.ru/product/index/id/3596968/
619011;Конструктор LEGO Classic Набор для творчества среднего размера (10696);2989;Moscow;NULL;https://www.detmir.ru/product/index/id/619011/
3596843;Конструктор LEGO Dots Брелок для сумки Единорог 41940;649;Moscow;NULL;https://www.detmir.ru/product/index/id/3596843/
3405566;Конструктор LEGO Dots Браслет Звёздное небо 41934;629;Moscow;NULL;https://www.detmir.ru/product/index/id/3405566/
3405629;Конструктор LEGO Ninjago Легендарные битвы: Зейн против Ниндроида 71731;949;Moscow;NULL;https://www.detmir.ru/product/index/id/3405629/
3498479;Конструктор LEGO Vidiyo Битбокс Любителя вечеринок Л.Л.А.М.А 43105;1789;Moscow;889;https://www.detmir.ru/product/index/id/3498479/
3988995;Конструктор LEGO Art Творческий проект Создаем вместе 21226;11989;Moscow;8989;https://www.detmir.ru/product/index/id/3988995/
3334779;Конструктор LEGO Disney Princess Башня Рапунцель 43187;6589;Moscow;5799;https://www.detmir.ru/product/index/id/3334779/
3156347;Конструктор LEGO 4+ Трюковое шоу Дюка Бубумса 10767;1789;Moscow;1449;https://www.detmir.ru/product/index/id/3156347/
3405599;Конструктор LEGO Super Heroes Взлёт Домо 76156;9589;Moscow;NULL;https://www.detmir.ru/product/index/id/3405599/
3226561;Конструктор LEGO DUPLO Princess Чаепитие у Эльзы и Олафа 10920;2029;Moscow;NULL;https://www.detmir.ru/product/index/id/3226561/
3597054;Конструктор LEGO Jurassic World Побег барионикса на катере 76942;8989;Moscow;NULL;https://www.detmir.ru/product/index/id/3597054/
3596970;Конструктор LEGO Super Mario Марио-лягушка 71392;1069;Moscow;659;https://www.detmir.ru/product/index/id/3596970/
3596890;Конструктор LEGO City Wildlife Спасательный вездеход для зверей 60300;889;Moscow;799;https://www.detmir.ru/product/index/id/3596890/
3018899;Конструктор LEGO Синяя базовая пластина Classic (10714);709;Moscow;432;https://www.detmir.ru/product/index/id/3018899/
3142205;Конструктор LEGO Movie Познакомьтесь с королевой Многоликой Прекрасной 70824;1789;Moscow;1199;https://www.detmir.ru/product/index/id/3142205/
3244600;Конструктор LEGO Minecraft Набор для творчества 3.0 21161;8989;Moscow;NULL;https://www.detmir.ru/product/index/id/3244600/
3596781;Конструктор LEGO Friends Лесной дом на колесах и парусная лодка 41681;5389;Moscow;NULL;https://www.detmir.ru/product/index/id/3596781/
3597049;Конструктор LEGO Speed Champions Chevrolet Corvette C8.R Race Car and 1968 Chevrolet Corvette 76903;4429;Moscow;NULL;https://www.detmir.ru/product/index/id/3597049/
3244549;Конструктор LEGO Super Heroes Халкбастер против агента А.И.М. 76164;4429;Moscow;NULL;https://www.detmir.ru/product/index/id/3244549/
3156348;Конструктор LEGO 4+ Приключения Базза и Бо Пип на детской площадке 10768;2629;Moscow;2199;https://www.detmir.ru/product/index/id/3156348/
3596972;Конструктор LEGO Ninjago Мотоцикл Кая 71734;949;Moscow;799;https://www.detmir.ru/product/index/id/3596972/
3405541;Конструктор LEGO Creator Домик на дереве для сафари 31116;3229;Moscow;NULL;https://www.detmir.ru/product/index/id/3405541/
3405649;Конструктор LEGO Technic Квадроцикл 42124;14989;Moscow;11999;https://www.detmir.ru/product/index/id/3405649/
3226647;Конструктор LEGO Disney Princess Праздник в замке Золушки 43178;2989;Moscow;NULL;https://www.detmir.ru/product/index/id/3226647/
3244590;Конструктор LEGO Ninjago Каменный робот огня 71720;7789;Moscow;NULL;https://www.detmir.ru/product/index/id/3244590/
3226646;Конструктор LEGO Disney Princess Книга приключений Белль 43177;2029;Moscow;1599;https://www.detmir.ru/product/index/id/3226646/
3405558;Конструктор LEGO Friends Кьюб Мии с мопсом 41664;889;Moscow;619;https://www.detmir.ru/product/index/id/3405558/
3405632;Конструктор LEGO Harry Potter Учёба в Хогвартсе Урок трансфигурации 76382;3349;Moscow;NULL;https://www.detmir.ru/product/index/id/3405632/
3144089;Конструктор LEGO Classic Базовый набор кубиков 11002;1909;Moscow;NULL;https://www.detmir.ru/product/index/id/3144089/
3405573;Конструктор LEGO Dots Брелок Леопард 41929;649;Moscow;NULL;https://www.detmir.ru/product/index/id/3405573/
3758559;Конструктор LEGO Star Wars TM Штурмовой шаттл Бракованной Партии 75314;11389;Moscow;NULL;https://www.detmir.ru/product/index/id/3758559/
3405640;Конструктор LEGO Star Wars Микрофайтеры Сокол тысячелетия 75295;1069;Moscow;NULL;https://www.detmir.ru/product/index/id/3405640/
3596842;Конструктор LEGO Dots Брелок для сумки Дракон 41939;649;Moscow;NULL;https://www.detmir.ru/product/index/id/3596842/
3596782;Конструктор LEGO Friends Школа Хартлейк Сити 41682;7789;Moscow;NULL;https://www.detmir.ru/product/index/id/3596782/
3596779;Конструктор LEGO Friends Лесной водопад 41677;949;Moscow;799;https://www.detmir.ru/product/index/id/3596779/
619041;Конструктор LEGO Classic Набор для творчества (10692);1549;Moscow;NULL;https://www.detmir.ru/product/index/id/619041/
3596927;Конструктор LEGO Super Mario Небесный мир лакиту 71389;4429;Moscow;NULL;https://www.detmir.ru/product/index/id/3596927/
3244511;Конструктор LEGO Friends Пляжный домик 41428;5389;Moscow;NULL;https://www.detmir.ru/product/index/id/3244511/
3142201;Конструктор LEGO Movie Набор кинорежиссёра 70820;4549;Moscow;NULL;https://www.detmir.ru/product/index/id/3142201/
3596775;Конструктор LEGO Friends Модный кьюб Эммы 41668;889;Moscow;NULL;https://www.detmir.ru/product/index/id/3596775/
3244528;Конструктор LEGO Dots Браслеты Приключения 41918;649;Moscow;NULL;https://www.detmir.ru/product/index/id/3244528/
3226571;Конструктор LEGO Classic Пластина базовая Белая 11010;709;Moscow;NULL;https://www.detmir.ru/product/index/id/3226571/
3596881;Конструктор LEGO Disney Princess Замок Белль и Чудовища 43196;8989;Moscow;NULL;https://www.detmir.ru/product/index/id/3596881/
3244580;Конструктор LEGO Super Mario Марио-пожарный 71370;1069;Moscow;NULL;https://www.detmir.ru/product/index/id/3244580/
3405615;Конструктор LEGO Super Mario дополнительный набор ядовитое болото егозы 71383;4429;Moscow;NULL;https://www.detmir.ru/product/index/id/3405615/
3405561;Конструктор LEGO Dots Тайлы — серия 3 41921;349;Moscow;249;https://www.detmir.ru/product/index/id/3405561/
3405554;Конструктор LEGO Friends Машина скорой ветеринарной помощи 41445;3109;Moscow;NULL;https://www.detmir.ru/product/index/id/3405554/
3244572;Конструктор LEGO Super Mario Охраняемая крепость 71362;5629;Moscow;NULL;https://www.detmir.ru/product/index/id/3244572/
3244581;Конструктор LEGO Super Mario Марио-вертолет 71371;1069;Moscow;NULL;https://www.detmir.ru/product/index/id/3244581/
3234224;Конструктор LEGO Trolls Домик-бутон Розочки 41251;2149;Moscow;1459;https://www.detmir.ru/product/index/id/3234224/
3597020;Конструктор LEGO Ninjago Подводный Дар Судьбы 71756;16189;Moscow;NULL;https://www.detmir.ru/product/index/id/3597020/
3226593;Конструктор LEGO Creator Грузовик Монстрбургер 31104;5389;Moscow;NULL;https://www.detmir.ru/product/index/id/3226593/
3226648;Конструктор LEGO City Police Полицейский отряд с собакой 60241;889;Moscow;NULL;https://www.detmir.ru/product/index/id/3226648/
3594629;Конструктор LEGO Super Heroes Бэтмен против Джокера погоня на Бэтмобиле 76180;3349;Moscow;NULL;https://www.detmir.ru/product/index/id/3594629/
3405556;Конструктор LEGO Friends Кьюб Оливии с фламинго 41662;889;Moscow;609;https://www.detmir.ru/product/index/id/3405556/
3405572;Конструктор LEGO Dots Брелок Нарвал 41928;649;Moscow;NULL;https://www.detmir.ru/product/index/id/3405572/
3226725;Конструктор LEGO Star Wars Истребитель Сид ситхов 75272;7569;Moscow;NULL;https://www.detmir.ru/product/index/id/3226725/
3405585;Конструктор LEGO City Police Полицейский вертолёт 60275;889;Moscow;NULL;https://www.detmir.ru/product/index/id/3405585/
3239915;Набор для творчества LEGO DOTS дополнительные элементы 109деталей 41908;289;Moscow;199;https://www.detmir.ru/product/index/id/3239915/
3405618;Конструктор LEGO Super Mario фигурки персонажей 71386;349;Moscow;NULL;https://www.detmir.ru/product/index/id/3405618/
3104158;Конструктор LEGO Unikitty Велосипед принца Паппикорна 41452;1309;Moscow;999;https://www.detmir.ru/product/index/id/3104158/
3405569;Конструктор LEGO Dots Брелок Щенок 41927;649;Moscow;NULL;https://www.detmir.ru/product/index/id/3405569/
3405562;Конструктор LEGO Dots Браслет Монстры 41923;629;Moscow;NULL;https://www.detmir.ru/product/index/id/3405562/
3226643;Конструктор LEGO Disney Princess Книга приключений Мулан 43174;1909;Moscow;NULL;https://www.detmir.ru/product/index/id/3226643/
3244583;Конструктор LEGO Super Mario Марио-строитель 71373;1069;Moscow;NULL;https://www.detmir.ru/product/index/id/3244583/
3498475;Конструктор LEGO Vidiyo Битбокс Карамельной Русалки 43102;1789;Moscow;889;https://www.detmir.ru/product/index/id/3498475/
3244555;Конструктор LEGO Super Heroes Чудо-женщина против Гепарды 76157;4189;Moscow;NULL;https://www.detmir.ru/product/index/id/3244555/
3226568;Конструктор LEGO Classic Синий 11006;469;Moscow;NULL;https://www.detmir.ru/product/index/id/3226568/
3596804;Конструктор LEGO DOTS Тайлы DOTS — серия 5 41932;349;Moscow;249;https://www.detmir.ru/product/index/id/3596804/
3239910;Набор для творчества LEGO DOTS Браслет Сверкающий единорог 41902;579;Moscow;NULL;https://www.detmir.ru/product/index/id/3239910/
3244535;Конструктор LEGO City Воздушная гонка 60260;2989;Moscow;NULL;https://www.detmir.ru/product/index/id/3244535/
3405575;Конструктор LEGO Dots Тайлы — серия 4 41931;349;Moscow;249;https://www.detmir.ru/product/index/id/3405575/
3239830;Набор для творчества LEGO DOTS Браслет Радуга 41900;529;Moscow;NULL;https://www.detmir.ru/product/index/id/3239830/
3498480;Конструктор LEGO Vidiyo Битбокс Диджея Единорога 43106;1789;Moscow;889;https://www.detmir.ru/product/index/id/3498480/
3226726;Конструктор LEGO Star Wars Истребитель типа Х По Дамерона 75273;11389;Moscow;NULL;https://www.detmir.ru/product/index/id/3226726/
3596880;Конструктор LEGO Disney Princess Королевская конюшня Белль и Рапунцель 43195;5509;Moscow;NULL;https://www.detmir.ru/product/index/id/3596880/
3244523;Конструктор LEGO Dots Тайлы Dots 41916;289;Moscow;219;https://www.detmir.ru/product/index/id/3244523/
3244577;Конструктор LEGO Super Mario Дом Марио и Йоши 71367;3229;Moscow;2899;https://www.detmir.ru/product/index/id/3244577/
3596969;Конструктор LEGO Super Mario Летучий корабль Боузера 71391;10789;Moscow;NULL;https://www.detmir.ru/product/index/id/3596969/
3244533;Конструктор LEGO City Исследовательская база 60265;5499;Moscow;NULL;https://www.detmir.ru/product/index/id/3244533/
3226666;Конструктор LEGO City Fire Пожарный спасательный вертолет 60248;2389;Moscow;NULL;https://www.detmir.ru/product/index/id/3226666/
3599725;Конструктор LEGO VIDIYO The Boombox (Бумбокс) 43115;10789;Moscow;5389;https://www.detmir.ru/product/index/id/3599725/
3200856;Конструктор LEGO Disney Frozen Заколдованный домик на дереве 41164;5389;Moscow;NULL;https://www.detmir.ru/product/index/id/3200856/
3405574;Конструктор LEGO Dots Брелок Панда 41930;649;Moscow;NULL;https://www.detmir.ru/product/index/id/3405574/
3244487;Конструктор LEGO Disney Princess Зимний праздник в замке Белль 43180;5149;Moscow;NULL;https://www.detmir.ru/product/index/id/3244487/
3176016;Конструктор LEGO DC Super Heroes Вторжение Глиноликого в бэт-пещеру 76122;10189;Moscow;NULL;https://www.detmir.ru/product/index/id/3176016/
3244515;Конструктор LEGO Friends Цветочный сад Оливии 41425;949;Moscow;NULL;https://www.detmir.ru/product/index/id/3244515/
3244573;Конструктор LEGO Super Mario Поки из пустыни 71363;2149;Moscow;NULL;https://www.detmir.ru/product/index/id/3244573/
3234223;Конструктор LEGO Trolls Вечеринка на техно-рифе 41250;2389;Moscow;NULL;https://www.detmir.ru/product/index/id/3234223/
3200859;Конструктор LEGO Disney Frozen Дорожные приключения Эльзы 41166;3109;Moscow;NULL;https://www.detmir.ru/product/index/id/3200859/
3244485;Конструктор LEGO Creator Отпуск в доме на колесах 31108;8989;Moscow;NULL;https://www.detmir.ru/product/index/id/3244485/
3244618;Конструктор LEGO Dots Браслет молния 41919;589;Moscow;NULL;https://www.detmir.ru/product/index/id/3244618/
3092814;Конструктор LEGO Friends Шкатулка дружбы 41346;4549;Moscow;NULL;https://www.detmir.ru/product/index/id/3092814/
3226594;Конструктор LEGO Creator Городской магазин игрушек 31105;4429;Moscow;NULL;https://www.detmir.ru/product/index/id/3226594/
3244574;Конструктор LEGO Super Mario Неприятности в крепости Вомпа 71364;2149;Moscow;NULL;https://www.detmir.ru/product/index/id/3244574/
3156360;Конструктор LEGO Star Wars Разрушение генераторов на Хоте 75239;2749;Moscow;NULL;https://www.detmir.ru/product/index/id/3156360/
3144103;Конструктор LEGO Disney Princess Башенка Жасмин 41158;1189;Moscow;999;https://www.detmir.ru/product/index/id/3144103/
3244529;Конструктор LEGO Dots Фоторамки 41914;2109;Moscow;NULL;https://www.detmir.ru/product/index/id/3244529/
3226564;Конструктор LEGO DUPLO Town Спальня 10926;1549;Moscow;NULL;https://www.detmir.ru/product/index/id/3226564/
3758558;Конструктор LEGO Super Mario Фигурки персонажей серия 3 71394;349;Moscow;NULL;https://www.detmir.ru/product/index/id/3758558/
3142209;Конструктор LEGO Movie Автобус для вечеринки 70828;8389;Moscow;6699;https://www.detmir.ru/product/index/id/3142209/
3244524;Конструктор LEGO Dots Браслет Чемпионки 41911;589;Moscow;NULL;https://www.detmir.ru/product/index/id/3244524/
3226569;Конструктор LEGO Classic Зеленый 11007;469;Moscow;NULL;https://www.detmir.ru/product/index/id/3226569/
3889880;Конструктор LEGO Super Heroes Человек-паук против атаки дронов Мистерио 76184;2149;Moscow;NULL;https://www.detmir.ru/product/index/id/3889880/
3142014;Конструктор LEGO DUPLO My First Мои первые цирковые животные 10884;1549;Moscow;NULL;https://www.detmir.ru/product/index/id/3142014/
3234226;Конструктор LEGO Trolls Приключение на плоту в Кантри-тауне 41253;2989;Moscow;NULL;https://www.detmir.ru/product/index/id/3234226/
3239909;Набор для творчества LEGO DOTS Браслет Забавные животные 41901;579;Moscow;NULL;https://www.detmir.ru/product/index/id/3239909/
3226566;Конструктор LEGO DUPLO Town Пекарня 10928;4069;Moscow;2799;https://www.detmir.ru/product/index/id/3226566/
3244531;Конструктор LEGO City Мини-подлодка 60263;889;Moscow;NULL;https://www.detmir.ru/product/index/id/3244531/
3239911;Набор для творчества LEGO DOTS Браслет Космические чудеса 41903;579;Moscow;NULL;https://www.detmir.ru/product/index/id/3239911/
3142039;Конструктор LEGO Friends Шоу талантов 41368;4789;Moscow;NULL;https://www.detmir.ru/product/index/id/3142039/
