id;name;price;city;promo_price;link
3244571;Конструктор LEGO Super Mario Фигурки персонажей 71361;349;Saint Petersburg;NULL;https://www.detmir.ru/product/index/id/3244571/
3226645;Конструктор LEGO Disney Princess Книга приключений Ариэль 43176;2029;Saint Petersburg;NULL;https://www.detmir.ru/product/index/id/3226645/
3226720;Конструктор LEGO Star Wars Боевой набор Мандалорцы 75267;1669;Saint Petersburg;NULL;https://www.detmir.ru/product/index/id/3226720/
3175868;Конструктор LEGO Friends Спасательный центр на маяке 41380;5749;Saint Petersburg;NULL;https://www.detmir.ru/product/index/id/3175868/
3226631;Конструктор LEGO Technic Мобильный кран 42108;11389;Saint Petersburg;NULL;https://www.detmir.ru/product/index/id/3226631/
3226726;Конструктор LEGO Star Wars Истребитель типа Х По Дамерона 75273;11389;Saint Petersburg;NULL;https://www.detmir.ru/product/index/id/3226726/
3405537;Конструктор LEGO Creator Кибердрон 31111;1069;Saint Petersburg;NULL;https://www.detmir.ru/product/index/id/3405537/
3405624;Конструктор LEGO Ninjago Турнир стихий 71735;3109;Saint Petersburg;NULL;https://www.detmir.ru/product/index/id/3405624/
3226629;Конструктор LEGO Technic Катамаран 42105;3699;Saint Petersburg;NULL;https://www.detmir.ru/product/index/id/3226629/
3156361;Конструктор LEGO Star Wars Истребитель СИД майора Вонрега 75240;5499;Saint Petersburg;NULL;https://www.detmir.ru/product/index/id/3156361/
3156358;Конструктор LEGO Star Wars Нападение на планету Эндор 75238;2749;Saint Petersburg;NULL;https://www.detmir.ru/product/index/id/3156358/
3405643;Конструктор LEGO Star Wars Истребитель типа Х Люка Скайуокера 75301;5629;Saint Petersburg;NULL;https://www.detmir.ru/product/index/id/3405643/
3244533;Конструктор LEGO City Исследовательская база 60265;5499;Saint Petersburg;NULL;https://www.detmir.ru/product/index/id/3244533/
3226666;Конструктор LEGO City Fire Пожарный спасательный вертолет 60248;2389;Saint Petersburg;NULL;https://www.detmir.ru/product/index/id/3226666/
3590734;Конструктор LEGO DUPLO Town Экспедиция на шаттле 10944;1789;Saint Petersburg;NULL;https://www.detmir.ru/product/index/id/3590734/
3244487;Конструктор LEGO Disney Princess Зимний праздник в замке Белль 43180;5149;Saint Petersburg;NULL;https://www.detmir.ru/product/index/id/3244487/
3176016;Конструктор LEGO DC Super Heroes Вторжение Глиноликого в бэт-пещеру 76122;10189;Saint Petersburg;NULL;https://www.detmir.ru/product/index/id/3176016/
3620625;Конструктор LEGO Creator Крокодил 31121;3229;Saint Petersburg;NULL;https://www.detmir.ru/product/index/id/3620625/
3405647;Конструктор LEGO Technic Спасательное судно на воздушной подушке 42120;3349;Saint Petersburg;NULL;https://www.detmir.ru/product/index/id/3405647/
3175842;Конструктор LEGO DUPLO Disney Летний домик Микки 10889;5029;Saint Petersburg;NULL;https://www.detmir.ru/product/index/id/3175842/
3175867;Конструктор LEGO Friends Спасение дельфинов 41378;3589;Saint Petersburg;NULL;https://www.detmir.ru/product/index/id/3175867/
3244588;Конструктор LEGO Ninjago Боевой дракон Мастера Ву 71718;1909;Saint Petersburg;NULL;https://www.detmir.ru/product/index/id/3244588/
3498471;Конструктор LEGO Disney Princess Райя и Дворец сердца 43181;8989;Saint Petersburg;NULL;https://www.detmir.ru/product/index/id/3498471/
3405594;Конструктор LEGO City Great Vehicles Транспортировка самолёта на авиашоу 60289;2989;Saint Petersburg;NULL;https://www.detmir.ru/product/index/id/3405594/
3475283;Конструктор LEGO City Great Vehicles Автовоз 60305;2989;Saint Petersburg;NULL;https://www.detmir.ru/product/index/id/3475283/
3142047;Конструктор LEGO Technic Chevrolet Corvette ZR1 42093;4429;Saint Petersburg;NULL;https://www.detmir.ru/product/index/id/3142047/
3546360;Конструктор LEGO Harry Potter Хогвартс-экспресс 75955;8989;Saint Petersburg;NULL;https://www.detmir.ru/product/index/id/3546360/
3092814;Конструктор LEGO Friends Шкатулка дружбы 41346;4549;Saint Petersburg;NULL;https://www.detmir.ru/product/index/id/3092814/
3142199;Конструктор LEGO City Police Автомобиль полицейского патруля 60239;889;Saint Petersburg;NULL;https://www.detmir.ru/product/index/id/3142199/
3226679;Конструктор LEGO City Great Vehicles Строительный бульдозер 60252;1789;Saint Petersburg;NULL;https://www.detmir.ru/product/index/id/3226679/
3405559;Конструктор LEGO Friends Кьюб Стефани с котёнком 41665;889;Saint Petersburg;597;https://www.detmir.ru/product/index/id/3405559/
3226594;Конструктор LEGO Creator Городской магазин игрушек 31105;4429;Saint Petersburg;NULL;https://www.detmir.ru/product/index/id/3226594/
3226651;Конструктор LEGO City Police Полицейский вертолетный транспорт 60244;4549;Saint Petersburg;NULL;https://www.detmir.ru/product/index/id/3226651/
3244481;Конструктор LEGO DUPLO Подводный замок Ариэль 10922;3109;Saint Petersburg;NULL;https://www.detmir.ru/product/index/id/3244481/
3244508;Конструктор LEGO Friends Домик для панд на дереве 41422;3109;Saint Petersburg;NULL;https://www.detmir.ru/product/index/id/3244508/
3244574;Конструктор LEGO Super Mario Неприятности в крепости Вомпа 71364;2149;Saint Petersburg;NULL;https://www.detmir.ru/product/index/id/3244574/
3226587;Конструктор LEGO Minecraft Приключения в тайге 21162;1069;Saint Petersburg;NULL;https://www.detmir.ru/product/index/id/3226587/
3144122;Конструктор LEGO Star Wars Микрофайтеры Истребитель с планеты Набу 75223;949;Saint Petersburg;NULL;https://www.detmir.ru/product/index/id/3144122/
3156360;Конструктор LEGO Star Wars Разрушение генераторов на Хоте 75239;2749;Saint Petersburg;NULL;https://www.detmir.ru/product/index/id/3156360/
3405648;Конструктор LEGO Technic Тяжелый экскаватор 42121;4309;Saint Petersburg;NULL;https://www.detmir.ru/product/index/id/3405648/
3596879;Конструктор LEGO Disney Princess Зимняя сказка Анны и Эльзы 43194;4309;Saint Petersburg;NULL;https://www.detmir.ru/product/index/id/3596879/
3596717;Конструктор LEGO DUPLO Disney Дом и кафе Минни 10942;5389;Moscow;4299;https://www.detmir.ru/product/index/id/3596717/
3405583;Конструктор LEGO City Fire Спасательный пожарный вертолёт 60281;2989;Moscow;2499;https://www.detmir.ru/product/index/id/3405583/
3226556;Конструктор LEGO DUPLO Classic Коробка с кубиками 10913;3109;Moscow;NULL;https://www.detmir.ru/product/index/id/3226556/
3620627;Конструктор LEGO City Wildlife Лагерь спасения дикой природы 60307;10789;Moscow;7999;https://www.detmir.ru/product/index/id/3620627/
3596885;Конструктор LEGO City Арена для шоу каскадёров 60295;10789;Moscow;7999;https://www.detmir.ru/product/index/id/3596885/
3405530;Конструктор LEGO DUPLO Town Фермерский трактор и животные 10950;1909;Moscow;1599;https://www.detmir.ru/product/index/id/3405530/
3405531;Конструктор LEGO DUPLO Town Конюшня для лошади и пони 10951;2989;Moscow;2399;https://www.detmir.ru/product/index/id/3405531/
3405588;Конструктор LEGO City Great Vehicles Отпуск в доме на колесах 60283;1789;Moscow;1499;https://www.detmir.ru/product/index/id/3405588/
3596716;Конструктор LEGO DUPLO Super Heroes Штаб-квартира Человека-паука 10940;3109;Moscow;2499;https://www.detmir.ru/product/index/id/3596716/
3596884;Конструктор LEGO Грузовик для шоу каскадёров 60294;6589;Moscow;5229;https://www.detmir.ru/product/index/id/3596884/
3475282;Конструктор LEGO DUPLO Classic Веселый день рождения 10958;6589;Moscow;4999;https://www.detmir.ru/product/index/id/3475282/
3596974;Конструктор LEGO Ninjago Дар Судьбы Решающая битва 71749;4309;Moscow;2999;https://www.detmir.ru/product/index/id/3596974/
3597019;Конструктор LEGO Ninjago Храм Бескрайнего моря 71755;11989;Moscow;9999;https://www.detmir.ru/product/index/id/3597019/
3244480;Конструктор LEGO DUPLO Башенный кран на стройке 10933;11989;Moscow;9499;https://www.detmir.ru/product/index/id/3244480/
3233714;Конструктор LEGO DUPLO Большая строительная пластина 2304;1549;Moscow;1299;https://www.detmir.ru/product/index/id/3233714/
3244473;Конструктор LEGO DUPLO Бульдозер 10930;889;Moscow;649;https://www.detmir.ru/product/index/id/3244473/
3596714;Конструктор LEGO Mickey and Friends Космическая ракета Микки и Минни 10774;1909;Moscow;1599;https://www.detmir.ru/product/index/id/3596714/
3244546;Конструктор LEGO Minions Бойцы кунг-фу 75550;4429;Moscow;2635;https://www.detmir.ru/product/index/id/3244546/
3405526;Конструктор LEGO DUPLO My First Единорог 10953;949;Moscow;659;https://www.detmir.ru/product/index/id/3405526/
3758560;Конструктор LEGO Star Wars Легкий имперский крейсер 75315;16189;Moscow;NULL;https://www.detmir.ru/product/index/id/3758560/
3596785;Конструктор LEGO Friends Американские горки на Волшебной ярмарке 41685;10189;Moscow;8799;https://www.detmir.ru/product/index/id/3596785/
3596759;Конструктор LEGO DUPLO Town Парк развлечений 10956;11989;Moscow;8299;https://www.detmir.ru/product/index/id/3596759/
618981;Конструктор LEGO Classic Строительная пластина зеленого цвета (10700);829;Moscow;599;https://www.detmir.ru/product/index/id/618981/
3405548;Конструктор LEGO Friends Органическое кафе Хартлейк-Сити 41444;3109;Moscow;2129;https://www.detmir.ru/product/index/id/3405548/
3596921;Конструктор LEGO City Wildlife 60302;10189;Moscow;7999;https://www.detmir.ru/product/index/id/3596921/
3244609;Конструктор LEGO MINDSTORMS EV3 Робот-изобретатель 51515;38389;Moscow;32599;https://www.detmir.ru/product/index/id/3244609/
3405551;Конструктор LEGO Friends Торговый центр Хартлейк Сити 41450;11389;Moscow;NULL;https://www.detmir.ru/product/index/id/3405551/
3405584;Конструктор LEGO City Fire Команда пожарных 60282;5989;Moscow;NULL;https://www.detmir.ru/product/index/id/3405584/
3475287;Конструктор LEGO Friends Парк Хартлейк Сити 41447;4309;Moscow;3199;https://www.detmir.ru/product/index/id/3475287/
4058545;Конструктор LEGO Disney Princess 43200;2029;Moscow;NULL;https://www.detmir.ru/product/index/id/4058545/
3193108;Конструктор LEGO Disney Frozen Волшебный ледяной замок Эльзы 43172;7789;Moscow;NULL;https://www.detmir.ru/product/index/id/3193108/
3596877;Конструктор LEGO Technic Бульдозер Cat D11T 42131;49189;Moscow;NULL;https://www.detmir.ru/product/index/id/3596877/
3596920;Конструктор LEGO City Wildlife Спасательный внедорожник для зверей 60301;4549;Moscow;3999;https://www.detmir.ru/product/index/id/3596920/
3405535;Конструктор LEGO Classic Прозрачные кубики 11013;3109;Moscow;NULL;https://www.detmir.ru/product/index/id/3405535/
3405614;Конструктор LEGO Super Mario дополнительный набор загадочное испытание растения-пираньи 71382;3229;Moscow;2099;https://www.detmir.ru/product/index/id/3405614/
3405550;Конструктор LEGO Friends Дом семьи Андреа 41449;7789;Moscow;6999;https://www.detmir.ru/product/index/id/3405550/
3596876;Конструктор LEGO Technic Полноприводный грузовик-внедорожник Mercedes-Benz Zetros 42129;31189;Moscow;NULL;https://www.detmir.ru/product/index/id/3596876/
3405544;Конструктор LEGO Disney Princess Королевская карета Золушки 43192;4309;Moscow;3869;https://www.detmir.ru/product/index/id/3405544/
3985290;Конструктор LEGO Super Heroes Бэтмобиль Тумблер 76240;26389;Moscow;NULL;https://www.detmir.ru/product/index/id/3985290/
3596756;Конструктор LEGO DUPLO Town Гоночные машины 10947;5389;Moscow;3769;https://www.detmir.ru/product/index/id/3596756/
3092804;Конструктор LEGO DUPLO Town Рельсы (10882);2149;Moscow;NULL;https://www.detmir.ru/product/index/id/3092804/
3244547;Конструктор LEGO Minions Миньоны и дом 75551;5629;Moscow;NULL;https://www.detmir.ru/product/index/id/3244547/
3596888;Конструктор LEGO City Stunt 60298;709;Moscow;629;https://www.detmir.ru/product/index/id/3596888/
3620623;Конструктор LEGO Mickey and Friends Ферма Микки и Дональда 10775;3109;Moscow;2399;https://www.detmir.ru/product/index/id/3620623/
3200882;Конструктор LEGO Disney Frozen Шкатулка Эльзы 41168;4309;Moscow;3869;https://www.detmir.ru/product/index/id/3200882/
3498474;Конструктор LEGO Vidiyo Бэндмейты 43101;469;Moscow;229;https://www.detmir.ru/product/index/id/3498474/
3777764;Конструктор LEGO City Occasions Новогодний календарь 60303;2029;Moscow;NULL;https://www.detmir.ru/product/index/id/3777764/
3596770;Конструктор LEGO Creator Колесо обозрения 31119;10189;Moscow;NULL;https://www.detmir.ru/product/index/id/3596770/
3405577;Конструктор LEGO My City Скейт-парк 60290;3139;Moscow;2799;https://www.detmir.ru/product/index/id/3405577/
3597021;Конструктор LEGO Star Wars Дуэль на Мандалоре 75310;2149;Moscow;1499;https://www.detmir.ru/product/index/id/3597021/
3596763;Конструктор LEGO Classic Вокруг света 11015;5389;Moscow;4499;https://www.detmir.ru/product/index/id/3596763/
3599721;Конструктор LEGO VIDIYO Candy Castle Stage (Сцена карамельного замка) 43111;2989;Moscow;1489;https://www.detmir.ru/product/index/id/3599721/
3777767;Конструктор LEGO Harry Potter Новогодний календарь 76390;3109;Moscow;NULL;https://www.detmir.ru/product/index/id/3777767/
3234225;Конструктор LEGO Trolls Путешествие Розочки на воздушном шаре 41252;3589;Moscow;2342;https://www.detmir.ru/product/index/id/3234225/
3777569;Конструктор LEGO Friends Новогодний календарь 41690;2389;Moscow;NULL;https://www.detmir.ru/product/index/id/3777569/
3405555;Конструктор LEGO Friends Ветеринарная клиника Хартлейк-Сити 41446;4309;Moscow;NULL;https://www.detmir.ru/product/index/id/3405555/
3405622;Конструктор LEGO Ninjago Деревня Хранителей 71747;5389;Moscow;NULL;https://www.detmir.ru/product/index/id/3405622/
3597051;Конструктор LEGO Jurassic World Побег стигимолоха 76939;4429;Moscow;3899;https://www.detmir.ru/product/index/id/3597051/
3596882;Конструктор LEGO Disney Princess Ледяной замок 43197;23629;Moscow;NULL;https://www.detmir.ru/product/index/id/3596882/
3226632;Конструктор LEGO Technic Гоночный автомобиль Top Gear 42109;14989;Moscow;NULL;https://www.detmir.ru/product/index/id/3226632/
3226570;Конструктор LEGO Classic Кубики и домики 11008;1909;Moscow;NULL;https://www.detmir.ru/product/index/id/3226570/
3597053;Конструктор LEGO Jurassic World Погоня за карнотавром 76941;5509;Moscow;NULL;https://www.detmir.ru/product/index/id/3597053/
3594634;Конструктор LEGO Star Wars Имперский разведывательный дроид 75306;8389;Moscow;NULL;https://www.detmir.ru/product/index/id/3594634/
3244612;Конструктор LEGO Technic Самосвал Volvo 6*6 42114;27589;Moscow;NULL;https://www.detmir.ru/product/index/id/3244612/
3597029;Конструктор LEGO Super Heroes «Мстители: Финал» — решающая битва 76192;10189;Moscow;NULL;https://www.detmir.ru/product/index/id/3597029/
3405542;Конструктор LEGO Creator Пляжный домик серферов 31118;5389;Moscow;NULL;https://www.detmir.ru/product/index/id/3405542/
3594628;Конструктор LEGO Super Heroes Битва в древней деревне 76177;4429;Moscow;NULL;https://www.detmir.ru/product/index/id/3594628/
3244544;Конструктор LEGO Minions Тренировочный полёт 75547;3589;Moscow;NULL;https://www.detmir.ru/product/index/id/3244544/
3405549;Конструктор LEGO Friends Кинотеатр Хартлейк-Сити 41448;5389;Moscow;4299;https://www.detmir.ru/product/index/id/3405549/
3596878;Конструктор LEGO Disney Princess Книга сказочных приключений Ариэль Белль Золушки и Тианы 43193;2389;Moscow;NULL;https://www.detmir.ru/product/index/id/3596878/
3405636;Конструктор LEGO Minecraft Коралловый риф 21164;1189;Moscow;NULL;https://www.detmir.ru/product/index/id/3405636/
3596926;Конструктор LEGO Super Mario Падающая башня босса братца-сумо 71388;3229;Moscow;2599;https://www.detmir.ru/product/index/id/3596926/
3188096;Конструктор LEGO DUPLO Princess Ледяной замок 10899;5389;Moscow;4849;https://www.detmir.ru/product/index/id/3188096/
3475286;Конструктор LEGO Friends Набор кубиков Хартлейк Сити 41431;4309;Moscow;NULL;https://www.detmir.ru/product/index/id/3475286/
3596783;Конструктор LEGO Friends Лесной клуб верховой езды 41683;7789;Moscow;6199;https://www.detmir.ru/product/index/id/3596783/
3597050;Конструктор LEGO Speed Champions Mopar Dodge//SRT Top Fuel Dragster and 1970 Dodge Challenger T/A 76904;6589;Moscow;NULL;https://www.detmir.ru/product/index/id/3597050/
3405529;Конструктор LEGO DUPLO Town Уход за животными на ферме 10949;889;Moscow;749;https://www.detmir.ru/product/index/id/3405529/
3405596;Конструктор LEGO Super Heroes Воздушное нападение Вечных 76145;1189;Moscow;NULL;https://www.detmir.ru/product/index/id/3405596/
3596715;Конструктор LEGO Mickey and Friends Пожарная часть и машина Микки и его друзей 10776;5389;Moscow;3769;https://www.detmir.ru/product/index/id/3596715/
3200890;Конструктор LEGO Star Wars Йода 75255;11389;Moscow;NULL;https://www.detmir.ru/product/index/id/3200890/
3599722;Конструктор LEGO VIDIYO Robo HipHop Car (Машина Хип-Хоп Робота) 43112;2989;Moscow;1489;https://www.detmir.ru/product/index/id/3599722/
3596887;Конструктор LEGO City Stunt 60297;709;Moscow;629;https://www.detmir.ru/product/index/id/3596887/
3244543;Конструктор LEGO Minions Миньоны в лаборатории Грю 75546;2149;Moscow;NULL;https://www.detmir.ru/product/index/id/3244543/
3405595;Конструктор LEGO Minifigures Минифигурки Серия 21 71029;289;Moscow;NULL;https://www.detmir.ru/product/index/id/3405595/
3405543;Конструктор LEGO Disney Princess Праздничный корабль Ариэль 43191;3109;Moscow;NULL;https://www.detmir.ru/product/index/id/3405543/
3596822;Конструктор LEGO Dots Подставка для карандашей 41936;2029;Moscow;NULL;https://www.detmir.ru/product/index/id/3596822/
3226702;Конструктор LEGO Minifigures DC Super Heroes Series 71026;289;Moscow;NULL;https://www.detmir.ru/product/index/id/3226702/
3405534;Конструктор LEGO Jurassic World Побег динозавров: тираннозавр и трицератопс 10939;3109;Moscow;NULL;https://www.detmir.ru/product/index/id/3405534/
3498483;Конструктор LEGO Star Wars Микрофайтеры AT-AT против таунтауна 75298;2149;Moscow;NULL;https://www.detmir.ru/product/index/id/3498483/
3244527;Конструктор LEGO Dots Браслет Мороженое 41910;649;Moscow;389;https://www.detmir.ru/product/index/id/3244527/
618971;Строительная пластина LEGO Classic Серая (10701);1549;Moscow;1299;https://www.detmir.ru/product/index/id/618971/
3596778;Конструктор LEGO Friends Кьюб Андреа для плавания 41671;889;Moscow;619;https://www.detmir.ru/product/index/id/3596778/
3498477;Конструктор LEGO Vidiyo Битбокс Диджея Пришельца 43104;1789;Moscow;889;https://www.detmir.ru/product/index/id/3498477/
3594627;Конструктор LEGO Super Heroes Побег от Десяти колец 76176;3349;Moscow;NULL;https://www.detmir.ru/product/index/id/3594627/
3405641;Конструктор LEGO Star Wars Испытание на Татуине 75299;3349;Moscow;NULL;https://www.detmir.ru/product/index/id/3405641/
3226558;Конструктор LEGO DUPLO Грузовик Алфавит 10915;2989;Moscow;NULL;https://www.detmir.ru/product/index/id/3226558/
3239916;Набор для творчества LEGO DOTS Браслет Попугайчики 41912;529;Moscow;299;https://www.detmir.ru/product/index/id/3239916/
3596976;Конструктор LEGO Ninjago Спидер-амфибия ниндзя 71752;4309;Moscow;NULL;https://www.detmir.ru/product/index/id/3596976/
3405533;Конструктор LEGO DUPLO Disney Праздничный поезд Микки и Минни 10941;3109;Moscow;NULL;https://www.detmir.ru/product/index/id/3405533/
3244576;Конструктор LEGO Super Mario Огневой налёт Билла-банзай 71366;3229;Moscow;2099;https://www.detmir.ru/product/index/id/3244576/
3405580;Конструктор LEGO City Town Дорожные пластины 60304;1789;Moscow;1599;https://www.detmir.ru/product/index/id/3405580/
3597018;Конструктор LEGO Ninjago Водный дракон 71754;7789;Moscow;NULL;https://www.detmir.ru/product/index/id/3597018/
3596774;Конструктор LEGO Friends Кьюб Оливии для игр 41667;889;Moscow;799;https://www.detmir.ru/product/index/id/3596774/
3405598;Конструктор LEGO Super Heroes Вечные перед лицом Аришема 76155;7789;Moscow;6899;https://www.detmir.ru/product/index/id/3405598/
3498482;Конструктор LEGO Star Wars Истребитель Сопротивления типа X 75297;2149;Moscow;NULL;https://www.detmir.ru/product/index/id/3498482/
3405616;Конструктор LEGO Super Mario набор усилений Марио-пингвин 71384;1069;Moscow;739;https://www.detmir.ru/product/index/id/3405616/
3596777;Конструктор LEGO Friends Кьюб для балета Стефани 41670;889;Moscow;619;https://www.detmir.ru/product/index/id/3596777/
3596840;Конструктор LEGO DOTS Творческий набор для дизайнера 41938;4309;Moscow;3699;https://www.detmir.ru/product/index/id/3596840/
3594626;Конструктор LEGO Minifigures Минифигурки Looney Tunes в непрозрачной упаковке (Сюрприз)71030;329;Moscow;NULL;https://www.detmir.ru/product/index/id/3594626/
3200881;Конструктор LEGO Disney Frozen Деревня в Эренделле 41167;8989;Moscow;6199;https://www.detmir.ru/product/index/id/3200881/
3498481;Конструктор LEGO Vidiyo Битбокс Хип-Хоп Робота 43107;1789;Moscow;889;https://www.detmir.ru/product/index/id/3498481/
3405592;Конструктор LEGO City Great Vehicles Трактор 60287;1789;Moscow;1499;https://www.detmir.ru/product/index/id/3405592/
3405628;Конструктор LEGO Ninjago Легендарные битвы: Кай против Армии скелетов 71730;949;Moscow;NULL;https://www.detmir.ru/product/index/id/3405628/
3244598;Конструктор LEGO Harry Potter Тисовая улица дом 4 75968;7789;Moscow;NULL;https://www.detmir.ru/product/index/id/3244598/
3405631;Конструктор LEGO Ninjago Легендарные битвы: Коул против Призрачного воина 71733;949;Moscow;NULL;https://www.detmir.ru/product/index/id/3405631/
3405553;Конструктор LEGO Friends Передвижной груминг-салон для кошек 41439;949;Moscow;799;https://www.detmir.ru/product/index/id/3405553/
